id,question,answer1,isCorrect1,answer2,isCorrect2,answer3,isCorrect3,answer4,isCorrect4,answer5,isCorrect5,answer6,isCorrect6,answer7,isCorrect7,answer8,isCorrect8
1090,"Pre gonozómovú dedičnosť je charakteristické, že:",gény sú umiestnené v homologických častiach chromozómov X a Y,0,gény sú umiestnené v heterologických častiach chromozómov,1,"fenotypový prejav alel závisí len od toho, či sú dominantné alebo recesívne",0,recipročné kríženia dávajú rovnaké výsledky,0,u mužov sa prejaví aj jedna recesívna alela,1,z pohlavia jedinca nie je dôležité z hľadiska prejavu znaku,0,je ovplyvňovaná mimojadrovými génmi,0,muži môžu byť pre daný znak heterozygotní,0
1091,Pri X chromozómovej dedičnosti u jedincov XY nachádzame:,dominantných homozygotov,0,heterozygotov,0,recesívnych homozygotov,0,kodominantné znaky,0,menej homozygotov ako heterozygotov,0,,1,,0,,0
1092,Pri monogénnej X chromozómovej dedičnosti je fenotypový prejav génu závislý:,len od jednej alely u žien,0,od počtu prekrižení chromozómov,0,od pohlavia ich nositeľa,1,od mimiojadrovej dedičnosti,0,od kvality aliel,1,od veľkosti X chromozómu,0,pri heterogametickom pohlaví od kvality génov v Y chromozóme,0,od sily väzby,0
1093,Pri autozómovej dedičnosti sú výsledky recipróčného kríženia:,rôzne pre obidve pohlavia,0,závislé od matky,0,závislé od otca,0,rovnaké pre obidve pohlavia,1,"nezávislé od toho, ktorý z rodičov mal dominantný a ktorý recesíwny",1,závislé od pohlavia potomka,0,rovnaké ako pri spiätnom krížení,0,zhodné,1
1094,Pri krížení bielookého samčeka drozofily s homozygotnou červenookou,všetky samičky a samčekov červenookých,1,polovicu samičiek červenookých a všetkých samčekov červenookých,0,uniformné červenooké potomstvo,1,všetky samičky červenooké a polovicu samčekov červenookých,0,polovicu samičiek aj samčekov červenookých,0,polovicu samčekov bielookých a všetky samičky červenooké,0,uniformne bielooké potomstvo,0,3/4 potomkov červenookých a 1/4 bielookých,0
1095,V potomstve heterozygotnej červenookej samičky drozofily s,všetkých samčekov červenookých a polovicu samičiek bielookých,0,polovicu samičiek bielookých a všetkých samčekov červenookých,1,polovicu samičiek bielookých a polovicu samčekov červenookých,0,všetky samičky červenooké a polovicu samčekov bielookých,0,polovicu potomstva červenookého a polovicu bielookého,1,všetky samičky bielooké a všetkých samčekov červenookých,0,uniformné červenooké potomstvo,0,uniformné bielooké potomstvo,0
1096,Príkladom X chromozómovej dedičnosti u človeka je:,hemofília a farba očí,0,daltonizmus a krátkozrakosť,0,daltonizmus,1,porucha metabolizmu lipidov,0,albinizmus,0,diabetes,0,hemofília,1,telesná hmotnosť,0
1097,Farboslepy muž a dominatne homozygotná žena pre tento znak budú mať:,všetkých synov farboslepých,0,všetky deti zdravé,1,polovicu dcér prenášačiek a 25% zdravých synov,0,50% zdravých synov a zdravé dcéry,0,všetky dcéry prenášačky,1,polovicu detí farboslepých bez rozdielu pohlavia,0,všetkých synov zdravých a polovicu dcér prenášačiek,0,všetkých synov zdravých,1
1098,Farbosleposť - daltonizmus je príkladom dedičnosti:,"recesívnej, viazanej na homologickú časť X chromozómu, alela sa prejaví vždy u mužov",0,"recesívnej, viazanaj na X chromozóm, alela sa prejavujú u mužov a u heterozygotných žien",0,"recesívnej, viazanaj na X chromozóm, recesívna alela sa vždy prejaví u mužov a u recesívne homozygotných žien",1,"recesívnej, alela viazaná na X chromozóm sa prejaví u 50% mužov, ak ju zdedia",0,gonozómovej,1,polygénnej,0,kvalitatívneho znaku,1,autozómove dominantnej,0
1099,X chromozómová dedičnosť recesívneho typu sa u človeka prejavuje:,častejším postihnutím mužov ako žien,1,rovnakým postihnutím mužov a žien,0,pri dedičných ochoreniach,1,"tak, že muži sú menej postihnutí ako ženy",0,"tak, že muži sú postihnutí len pri inbridingu",0,napr. poruchou zrážanlivosti krvi,1,častejším postihnutím žien ako mužov,0,napr. pri daltonizme,1
1100,Pri daltonizme u človeka:,môže mať žena len dva rôzne genotypy,0,,1,,0,,1,,0,,1,,0,,1
1101,"Aké potomstvo môže mať muž hemofilik so zdravou manželkou, ktorá nie je prenášačkou:",zdravé dcéry aj zdravých synov,1,zdravé dcéry a postihnutých synov,0,zdravých synov a postihnuté dcéry,0,zdravých synov a dcéry prenášačky,1,polovicu dcér prenášačiek a všetkých synov postihnutých,0,postihnutých synov aj dcéry,0,"dcéry prenášačky, ktoré môžu mať zdravých synov",1,všetky deti zdravé a heterozygotné pre daný znak,0
1102,"Žena s recesívnou alelou pre hemofíliu čaká dieťa so zdravým mužom, aká je pravdepodobnosť, že sa jej narodí zdravý syn:",70 %,0,25 %,1,50 %,0,"50 %, ak je plod mužského pohlavia",1,75 %,0,100 %,0,0 %,0,"12,5 %",0
1103,"Žena, ktorá je prenášačkou alely pre hemofíliu, čaká dieťa so zdravým mužom. Aké potomstvo môžeme očakávať?:","25% zdravých synov, lebo sa jedná o neúplne dominantnú alelu",0,"polovicu zo synov postihnutých, lebo sa jedná o recesívnu alelu",1,50% zdravého potomstva bez ohľadu na pohlavie,0,25% zdravých synov a 75% dcér budú prenášačky,0,zdravých synov a postihnuté dcéry,0,všetky deti zdravé,0,50 % zo synov zdravých a 50 % z dcér prenášačiek,1,všetky deti postihnuté,0
1104,Majú deti zdravého muža a farboslepej ženy schopnosť rozlišovať červenú a zelenú farbu:,"všetky dcéry majú, zo synov len 50%",0,,1,,0,,0,,1,,0,,0,,0
1105,Heterochromozómy sú:,chromozómy s nerovnakými génnmi u ženy,0,pohlavné chromozómy,1,len v pohlavných bunkách,0,odlišne sa farbiace chromozómy u ženy,0,zodpovedné za vývin pohlavia cicavcov,1,"chromozómy, na ktorých sú len gény určujúce pohlavie",0,mimojadrové chromozómy,0,sú chromozómy neobsahujúce chromatin,0
1106,Chromozóm Y:,býva obyčajne väčší ako X chromozóm,0,u niektorých druhov sa nevyskytuje,1,patrí medzi gonozómy,1,sa nachádza v povlci samičích gamét cicavcov,0,musia mať všetci jedinci určitého druhu,0,obsahuje menej génov ako X chromozóm,1,sa nachádza v somatických bunkách samíc vtákov,1,sa vyskytuje len v bunkách jedincov homogametického pohlavia,0
1107,Označte nesprávne tvrdenie:,pri chromozómovom určení pohlavia typu drozofila je samčie pohlavie heterogametné XY,0,pri chromozómovom určení pohlavia typu drozofila je samčie pohlavie homogametné XX,1,pri chromozómovom určení pohlavia typu drozofila je samčie pohlavie heterogametné XX,1,pri chromozómovom určení pohlavia typu drozofila je samčie pohlavie homogametné XY,1,pri chromozómovom určení pohlavia typu abraxas je samčie pohlavie homogametné XX,1,pri chromozómovom určení pohlavia typu abraxas je samčie pohlavie heterogametné XY,0,pri chromozómovom určení pohlavia typu abraxas je samčie pohlavie homogametné XY,1,pri chromozómovom určení pohlavia typu abraxas je samčie pohlavie heterogametné XX,1
1108,Označte správnou odpověď:,pri chromozómovom určení pohlavia typu drozofila je samičie pohlavie heterogametné XY,0,pri chromozómovom určení pohlavia typu drozofila je samičie pohlavie homogametné XX,1,pri chromozómovom určení pohlavia typu drozofila je samičie pohlavie heterogametné XX,0,pri chromozómovom určení pohlavia typu drozofila je samičie pohlavie homogametné XY,0,pri chromozómovom určení pohlavia typu abraxas je samčie pohlavie homogametné XX,1,pri chromozómovom určení pohlavia typu abraxas je samčie pohlavie heterogametné XY,0,pri chromozómovom určení pohlavia typu abraxas je samčie pohlavie homogametné XY,0,pri chromozómovom určení pohlavia typu abraxas je samčie pohlavie heterogametné XX,0
1109,Holandský typ dedičnosti:,sa uplatňuje pri dedičnosti hemofilie,0,sa uplatňuje pri dedičnosti daltonizmu,0,sa uplatňuje pri dedičnosti farby očí,0,sa uplatňuje pri dedičnosti testes determinujúceho faktora,1,"sa prejavuje vtedy, keď sa alela génu nachádza na homologickom úseku X chromozómu",0,"sa prejavuje vtedy, keď sa alela génu nachádza na nehomologickom úseku X chromozómu",0,"sa prejavuje vtedy, keď sa alela génu nachádza na homologickom úseku Y chromozómu",0,"sa prejavuje vtedy, keď sa alela génu nachádza na nehomologickom úseku Y chromozómu",1
1110,Ak sa pri dedičnosti viažanej na X chromozóm prejaví dedičnosť krížom:,synovia budú mať rovnakú kvalitu znaku ako otec,0,synovia budú mať rovnakú kvalitu znaku ako matka,1,dcéry budú mať rovnaký znak ako otec,1,dcéry budú mať rovnaký znak ako matka,0,otec odozdváva genetickú informáciu na X chromozóme synom,0,otec nikdy neodovzdáva genetickú informáciu na X chromozóme synom,1,musí mať pohlavie XX dve dominantné alely a pohlavie XY na X chromozóme recesívnú alelu,0,musí mať pohlavie XX dve recesívne alely a pohlavie XY na X chromozóme dominantnú alelu,1
1111,Vyberte správne tvrdenie:,pri dedičnosti viazanej na X chromozóm sú geny lokalizované,0,pri dedičnosti viazanej na X chromozóm sú geny lokalizované,1,pri holandrickom type dedičnosti sú geny lokalizované na homologickom,0,pri holandrickom type dedičnosti sú geny lokalizované na nehomologickom,1,chromozómy X a Y nemajú navzájom homologické úseky,0,chromozómy X a Y majú navzájom homologické úseky,1,pri dedičnosti neúplne viazanej na pohlavie sú geny lokalizované,1,pri dedičnosti neúplne viazanej na pohlavie sú geny lokalizované,0
1112,"O génoch, ktoré sú umiestnené na pohlavných chromozómoch, môžem",gonozómy,0,heterochromozómy,0,viazané na pohlavie,1,pohlavné chromozómy,0,autozómy,0,somatické chromozómy,0,"vo väzbe, ak sa nachádzajú na tóm istom chromozóme",1,potrebné nielen pre tvorbu pohlavných znakov,1
1113,Haploidné mužské pohlavné bunky majú:,polovičný počet chromozómov a obidva gonozómy,0,haploidný počet autozómov a chromozómy XX,0,haploidný počet gonozómov a autozómov,1,"polovičný počet chromozómov, X alebo Y heterochromozómov",1,nerovnakú výbavu gonozómov,1,častejší výskyt chromozómu Y,0,veľa bunkových organel a zásobných látok,0,pohybovú organelu,1
1114,Pri voľnej kombinovateľnosti:,neplatia Mendelove zákony,0,sa vždy tvoria len rodičovské typy gamét,0,platia Mendelove zákony,1,"môže heterozygot AaBb vytvárať štyri typy gamét: AB, Ab, aB, ab",1,"môže heterozygot AaBb vytvárať štyri typy gamét: AA, Aa, Bb, bb",0,"môže heterozygot AaBb vytvárať iba dva typy gamét: AB, ab",0,"môže heterozygot AaBb vytvárať dva typy gamét: Aa, Bb",0,môže heterozygot AaBb vytvárať štyri typy gamét podľa princípu každý,1
1115,Pre dedičnosť znakov kódovaných mimojadrovou DNA:,platia rovnaké mechanizmy ako pri jadrovcj DNA,0,neplatia Mendelove zákony,1,"platí, že má význam v dedičnosti človeka",1,sú dôležité gény mitochondrií resp. chloroplastov,1,"platí, že u človeka sa na nej podieľajú obaja rodičia",0,platia Mendelove zákony,0,"platí, že mimojadrové kódovaný znak sa dedí len od otca",0,"platí, že mimojadrové kódovaný znak sa zväčša dedí len od matky",1
1116,Čo je podstatou mimojadrových génov v eukaryotických bunkách:,molekula RNA,0,plastidy a ribozómy,0,molekula DNA,1,RNA a DNA,0,RNA mitochondrií a chloroplastov,1,DNA mitochondrií a chlorplastov,0,DNA plazmidov v baktériálnych bunkách,1,rRNA ribozómov,0
1117,"Funkcia mimojadrových molekúl DNA v eukaryotických bunkách spočíva v tom, že:",nahrádzajú chýbajúcu informáciu v jadrovej DNA,0,obsahujú gény dôležité pre metabolizmus cukrov v cytoplazme,0,"obsahujú genetickú informáciu pre autoreprodukciu organel, v ktorých sa nachádzajú",1,sa vyskytujú vo všetkých membránových štruktúrach bunky,0,sú matricou pre transkripciu RNA,1,obsahujú informáciu pre fotosyntézu,1,"obsahujú štruktúrne gény, potrebné pre špecifickú funkciu mitochondrií",1,obsahujú len gény pre rRNA,0
1118,Mitochondrie v eukaryotických bunkách vznikli:,vúdobovaním bakĸtérií,1,formovaním protoplazmy,0,neogenézou,0,koacerváciou,0,ako výsledok evolúcie eukaryotických buniek,1,z endoplazmatického retikula počas evolúcie,0,diferenciáciou z Golgihova aparátu,0,z vákuol obsahujúcich DNA,0
1119,Plastidy v eukaryotických bunkách vznikli:,neogenézou,0,replikáciou,0,vúdobovaním siníc,1,formovaním protoplazmy,0,,1,,0,,0,,0
1120,Mutácie sú:,výmeny úsekov DNA medzi nehomologickými chromozómami,1,zmeny genetickej informácie,1,základom vzniku nových druhov v prírode,1,dedičné zmeny,1,napr. záměny báz DNA,1,dedičné aj nededičné zmeny genotypu,0,zmeny genotypu,1,nededičné zmeny fenotypu,0
1121,Mutácie najčastejšie vyvolávajú:,zmenu koeficientu dedivosti,0,premenlivosť genotypu,1,úplné znevýhodnenie prežívania organizmu,0,elimináciu jedinca prirodzeným výberom,0,zmenu v pomere pohlaví,0,zmenu komplementarity medzi purínovými bázami i,0,zmenu genetickej informácie,1,stratu schopnosti replikácie DNA,0
1122,Mutácie sú:,najčastejšie dominantné a kodominantné,0,zmeny genetickej informácie,1,zdrojom rozšírenia genetickej variability,1,príčinou vrodených porúch metabolizmu,1,najčastejšie dominantné so zníženou aktivitou,0,zmeny tvaru bunkového jadra,0,nededičné zmeny,0,vyvolávané selekciou,0
1123,Indukované mutácie:,"sú cielené, predvídateľné zmeny génov",0,vznikajú po zámernom pôsobení mutagénov,1,sú náhle zmeny genetickeho materiálu,1,môžu byt gametické alebo somatické,1,vznikajú len v deliacich sa bunkách,0,nevznikajú v gamétach,0,môžu byť pre organizmus prospešné,1,môžu byt pre organizmus škodlivé,1
1124,Indukované mutácie:,vznikajú v podstate inými mechanizmami ako spontánne,0,,1,,0,,1,,0,,1,,0,,0
1125,Ktoré tvrdenie je správne:,prevážna väčšina mutácií zlepšuje vlastnosti organizmu,0,výskyt somatických mutácií stúpa s vekom jedinca,1,mutácie môžu zmeniť biochemické vlastnosti bunky,1,"mutácie majú význam, len ak sa vyskytnú v gaméte",0,autozómy sú častejšie postihované mutáciami ako heterochromozómy,0,mutácie majú význam pre evolúciu druhov,1,o šírení mutovaných génov v populácii rozhoduje prírodný výber,1,mutácie nemôžu ovplyvniť reprodukčnú schopnosť organizmov,0
1126,Mutácie môžu byť:,dedičné zmeny,1,dedičné a nededičné zmeny,0,dominantné a recesívne,1,fenotypové a genotypové,0,spontánne a dedičné,0,príčinou nádorových ochorení,1,génové a chromozómové,1,genómové a chromatinové,0
1127,Spontánne mutácie:,nie sú náhodným javom vzhľadom na jednotlivé bunky,0,sú náhodným javom vzhľadom na chromozómy bunky,1,"sú tým častejšie, čím je väčší génom bunky",1,sa vyskytujú v závislosti od dĺžky bunkového cyklu,1,sa vyskytujú v relatívne veľkom počte,0,nemajú význam pre dedičnosť človeka,0,vznikajú bez zásahov človeka,1,prispievajú k stabilite genofondu,0
1128,"Význam mutácií spočíva v tom, že:",rozširujú spektrum alel v genofonde populácie,1,vždy zlepšujú genetickú výbavu mutantov,0,rozširujú len fenotypovú premennosť,0,sú zdrojom dedičnej premenlivosti,1,väčšinou sú nevýhodné pre svojho nositeľa,1,sú predpokladom pôsobenia prírodného výberu,1,umožňujú cicelene opraviť poškodený gén,0,umožňujú správnu diferenciáciu buniek počas ontogenézy,0
1129,Označte správne odpovede:,podľa stupňa organizácie genetickiej informácie rozlišujeme 4 typy mutácií,0,zmena počtu chromozómov v bunke sa nazýva genómová mutácia,1,zmena štruktúry chromozómov sa nazýva chromozómová aberácia,1,"mutácie delíme na dominantné a recesívne podľa činiteľov, ktoré ich vyvolávajú",0,genóvove mutácie sú menej významné,0,mutácie môžu byť spontánne alebo indukované,1,mutácie vznikajú len v štruktúrnych génoch,0,mutácie nevznikajú v mimojadrových molekulách DNA,0
1130,Chybajuca otazka,,0,,1,,1,,1,,0,,0,,1,,0
1131,Antimutagény sú:,analógy báz,0,"chemické látky, ktoré priamo poškodzujú DNA",0,niektoré vitamíny,1,látky zabraňujúce tvorbe voľných radikálov,1,niektoré mykotoxíny,0,"látky, ktoré znižujú frekvenciu mutácií",1,"napr. antioxidanty – vitamín C, E a karotenoidy",1,"látky, ktoré zvyšujú frekvenciu mutácií",0
1132,K fyziálkym mutagénom patria:,antioxidanty,0,vírusy,0,pesticídy,0,UV žiarenie,1,röntgenové žiarenie,1,infračervené žiarenie,0,"chemické látky, ktoré zvyšujú početnosť mutácií",0,rôzne druhy ionizačného a neionizačného žiarenia,1
1133,K biologickým mutagénom patria:,antioxidanty,0,niektoré vírusy,1,onkogénne vírusy,1,niektoré lieky,0,niektoré konzervačné látky,0,organické jedy,0,selén,0,hormóny,0
1134,Dedčiná premenlivosť:,môže byť spôsobená mutáciami,1,môže byť spôsobená rekombináciami ako výsledok crossing-overu,1,"znamená, že pozorované odchýlky sa dedia",1,"znamená, že pozorované odchýlky sa nededia",0,je spôsobená rozdelením alel do gamét počas meiózy,1,môže byť spôsobená vegetatívnym rozmnožovaním,0,môže byť spôsobená pohlavným rozmnožovaním,1,"znamená, že pozorované odchýlky sa neprenášajú pohlavnou cestou na potomkov",0
1135,Nutedičná premenlivosť’ je výsledkom:,mutácie génov,0,vplyvu vonkajšieho prostredia,1,zníženej adaptability,0,porúch genetických mechanizmov,0,mutačí spôsobených vonkajším prostredím,0,pôsobenia génov malého účinku,0,pôsobenia génov viazaných na pohlavie,0,prispôsobenia sa organizmu zmenám prostredia počas ontogenézy,1
1136,Génové mutácie:,spôsobujú zmenu karyotypu,0,vyvolávajú polyploidiu,0,spôsobujú vždy zmenu fenotypu,0,môžu zmeniť počet nukleotidov v DNA,1,môžu spôsobiť dedičné ochorenia,1,môžu meniť genetický kód,0,často zlepšujú prežívanie ich nositeľa,0,môžu byť vyvolané faktormi vonkajšieho prostredia,1
1137,Príčinou génových mutácií je:,schopnosť mutagénov reagovať s DNA,1,pokles aktivity repáračných enzýmov,1,zlom chromatídy,0,zlom chromozómu,0,zmeny v molekule DNA,1,zámena jedného alebo niekoľkých nukleotidov,1,strata jedného alebo niekoľkých nukleotidov,1,strata časti chromozómu,0
1138,Strata jedného nukleotidu v DNA sa prejaví:,s väčším účinkom ako zámena nukleotidu,1,s menším účinkom ako zámena nukleotidu,0,zmenou genetickej informácie,1,vždy rovnakým účinkom ako zámena nukleotidu,0,,0,,1,,0,,0
1139,"Zámena jedného nukleotidu v DNA štruktúrneho génu sa prejaví tak, že:",musí byť zaradená do polypeptidu iná aminokyselina,0,nemusí byť zaradená iná aminokyselina,1,sa syntéza polypeptidu musí predčasne ukončiť,0,môžu byť zaradené dve aminokyseliny namiesto jednej,0,sa zmení aj komplementárna báza v mRNA,1,môže dôjsť k zmene aktivity kódovaného enzýmu,1,dôjde k zmene počtu aminokyselín v kódovanej bielkovine,0,nie je možná transkripcia génu,0
1140,Zaradenie nadpočetného nukleotidu sa prejaví:,rovnakým účinkom ako pri jeho zámane,0,"len na úrovni DNA, bez vplyvu na kódovaný polypeptid, lebo sa nezníži počet báz",0,najčastejšie zmenou zaradenia aminokyselín do polypeptidu,1,zvýšeným počtom aminokyselín v polypeptide,0,v zmenie viacerých tripletov v štruktúrnom géne,1,vo väčšine prípadov pozitívne,0,zmenou geneticked informácie,1,morfológickou zmenou chromozómu,0
1141,Medzi génové mutácie zaradíme:,zmenu poradia génov na chromozóme,0,zmeny molekulovej hmotnosti DNA,0,zmeny počtu chromozómov v gamétach,0,zmeny poradia alebo počtu nukleotidov v určitom géne,1,zámenu nukleotidov v triplete,1,zmeny v rýchlosti transkripcie,0,začlenenie nadpočetných báz do DNA,1,zmeny tvaru chromozómov,0
1142,Génové mutácie:,majú v niektorých prípadoch molekulovú podstatu,0,sú častejšie výsledkom zámeny normálnej bázy za neprirodzenú,0,môžu vzniknúť stratou niekoľkých nukleotidov,1,môžu vzniknúť zaradením nadpočetného nukleotidu,1,sú väčšinou dominantné,0,u človeka sú často zodpovedné za metabolické poruchy,1,sú zmeny počtu chromozómov v jadre,0,môžu vzniknúť aj v mitochondriálnej DNA,1
1143,"Príkladom génovej mutácie u človeka je mutácia, ktorú spôsobuje:",angínu,0,chrípku,0,Downov syndróm,0,albinizmus,1,koščátkovú anémiu,1,hemofíliu,1,cystickú fibrózu,1,fenylketonúriu,1
1144,Chromozómové mutácie sú:,zmeny genetického kódu chromozómu,0,štrukturálne zmeny chromozómov,1,zmeny tvaru chromozómov,1,chromozómové aberácie,1,straty častí chromozómov,1,straty nukleotidov DNA,0,zmeny nukleotidov DNA,0,zmeny počtu chromozómov,0
1145,Ako sa nazýva strata časti chromozómu:,duplikácia,0,inverzia,0,degradácia,0,delécia,1,translokácia,0,fragmentácia,0,inaktivácia,0,segregácia,0
1146,Genómové mutácie postihujú:,genetický materiál na úrovni štruktúry chromatid,0,genetický kód,0,genetický materiál na úrovni štruktúry jednotlivých chromozómov,0,jednotlivé gény,0,dominantné alely,0,nukleotidy,0,plazmidy,0,chromozómové sady v bunkovom jadre,1
1147,Aneuploidia znamená:,znížený počet chromozómov,1,zvýšený počet chromozómov,1,znížený alebo zvýšený počet určitých chromozómov,1,napr. nulizomický karyotyp,1,napr. trizomický karyotyp,1,napr. karyotyp s monozómiou,1,zmenu tvaru chromozómu,0,stratu časti chromozómu,0
1148,Zvýšenie počtu jadrových chromozómov o jeden chromozóm sa nazýva:,triploidia,0,triplikácia,0,triáda,0,trizómia,1,triplex,0,reduplikácia,0,,0,,0
1149,Pri génových mutáciách sa:,nemení počet chromozómov v bunke,0,mení počet chromozómov v bunke,1,menia gény,0,nemenia gény,1,mení karyotyp,1,nemení karyotyp,0,mení štruktúra jednotlivých chromozómov,0,nemení štruktúra jednotlivých chromozómov,1
1150,Príkladom génovej mutácie u človeka je:,albinizmus,0,hemofília,0,Turnerov syndróm,1,Downov syndróm,1,monozómia X chromozómu,1,daltonizmus,0,galaktozémia,0,Klinefelterov syndróm,1
1151,Chromozómové aberácie:,patria medzi génové mutácie,0,predstavujú chromozómové mutácie,1,môžu byť príčakou bunkového delenia,1,u človeka sú relatívne časté,1,nemajú význam pre preživanie zygóty,0,u človeka spôsobujú patologické syndrómy,1,sú typické najmä pre prokaryotické organizmy,0,vznikajú najčastejšie v mitochondriách a chloroplastoch,0
1152,Vznik chromozómovej mutácie je podmienený:,chybnou transkripciou RNA,0,pôsobením mutagénov,1,nervonormálnym rozostupením chromozómov počas meiózy,0,zlomom chromozómu,1,stratou chromozómu,0,štruktúrnou poruchou chromozómu,1,poruchou segregácie chromozómov v heterotyptickom delení medzi,0,poruchou cytokinézy,0
1153,Chromozómová translokácia:,je strata časti chromozómu,0,je otočenie určitého úseku chromozómu o 180°,0,je výmena úsekov dvoch homologických chromozómov,0,je výmena úsekov dvoch nehomologických chromozómov,1,"je chromozómová aberácia, pri ktorej sa mení počet génu v génote",0,"je zmena, ktorá mení vzájomné skupiny genů",1,je mutácia meniaca počet chromozómových sád,0,je strata chromozómu,0
1154,"Mutácia, pri ktorej dochádza k strate vnútorného úseku chromozómu, sa nazýva:",translokácia,0,inverzia,0,duplikácia,0,monozómia,0,haploidia,0,delécia,1,chromozómová mutácia,1,géová mutácia,0
1155,Mutácie majú význam:,pozitívny len v niektorých prípadoch,1,pri dedičnej premenlivosti,1,pre fylogenetický vývoj,1,pre vznik dedičných ochorení,1,vždy negatívny,0,vždy pozitívny,0,v sPlachtitel'stve,1,ako spôsob liečenia dedičných ochorení,0
1156,Polyploidia znamená:,zvýšenie potču len homologických chromozómov,0,zvýšenie počtu chromozómových sád,1,zvýšený počet regulačných a štruktúrnych génov,0,nadmerne veľké chromozómy,0,napr. triploidia alebo tetraploidia,1,zvýšenie počtu pohlavných chromozómov,0,pre cicavcov neschopnosť prežívania,1,zmenu tvaru chromozómov,0
1157,Haploidia:,je typická pre somatické bunky včely robotnice,0,je typická pre pohlavné bunky človeka,1,je typická pre somatické bunky človeka,0,"znamená, že v génóme jeden chromozóm chýba",0,je pre rastliny všeobecne nezlučiteľná so životom,0,je pre človeka nezlučiteľná so životom,1,je pre cicavce nezlučiteľná so životom,1,je typická pre somatické bunky trúda,1
1158,Najčastejšie sa vyskytujúcou aneuploidiou somatických chromozómov,hemofília,0,cystická fibróza,0,monozómia chromozómu 21,0,Turnerov syndróm,0,Klinefelterov syndróm,0,Patauov syndróm,0,Downov syndróm,1,trizómia chromozómov 21,1
1159,Pri génových mutáciách:,sa menia géby genomu bunky,0,sa menia géby genomu jedinca,0,,0,,1,,1,,1,,0,,0
1160,Gaméty s chromozómovou mutáciou:,nemajú zníženú oplodňovaciu schopnosť,0,môžu utvárať neživotaschopné zygoty,1,môžu byť príčinou sterility,1,nemajú vplyv na fertilittu,0,sa vyskytujú len pri jedincocch heterogametického pohlavia,0,môžu byť výsledkom vplyvu mutagénov,1,môžu byť príčinou vážneho poškodenia plodu,1,môžu vznikať spontánne bez zásahu človeka,1
1161,Triploidní jedinci pri cicavcoch sú:,eliminovaní prírodným výberom,1,neschopní prežívať,1,hospodársky výhodní pre ich vyššiu užitkovosť,0,výsledkom poruchy pri tvorbe gamét rodičov,1,plodnejší,0,málo odolní voči vplyvom vonkajšieho prostredia,0,získavaní medzidruhovou hybridizáciou,0,cielene šľachtení,0
