id,question,answer1,isCorrect1,answer2,isCorrect2,answer3,isCorrect3,answer4,isCorrect4,answer5,isCorrect5,answer6,isCorrect6,answer7,isCorrect7,answer8,isCorrect8
792,Glukagón u človeka:,ovplyvňuje koncentráciu cukru v krvi,1,ovplyvňuje glykémiu,1,patrí medzi glukokortikoidy,0,patrí medzi glandotropné hormóny,0,pri zvýšenej produkcii môže zhoršiť priebeh cukrovky,1,patrí medzi tráviace enzýmy,0,tvorí sa v príšťitných telieskach,0,spôsobuje akromegáliu,0
793,Ktoré hormóny zvyšujú u ľudí hladinu glukózy v krvi:,noradrenalín a kortikotropín,0,hormóny drene nadobličiek,1,glukokortikoidy,1,inzulín,0,adrenalín a kortikotropín,0,adrenalín a noradrenalín,1,adrenalín a inzulín,0,glukagón,1
794,Z ktorých častí sa skladajú nadobličky dospelého človeka:,z drene a prispôsobeného tkániva,0,"z obličky, nadobličky a vlastnej endokrinnej žľazy",0,z adrenalínu a noradrenalínu,0,zo sivej a bielej hmoty,0,z drene a šuškovitého teleska,0,z kôry a hormónov,0,z kôry a drene,1,z kortexu a drene,1
795,Hormóny drene nadobličiek u človeka:,znižujú hladinu glukózy v krvi,0,"delíme na mineralokortikoidy, glukokortikoidy a androgénne hormóny",0,podnecujú zadržiavanie sodíka v organizme,0,zvyšujú hladinu krvného cukru,1,ovplyvňujú činnosť srdca,1,"zvyšujú hladinu krvného cukru, okrem glukózy",0,sú aldosterón a antidiuretický hormón,0,sú názov najdôležitejších hormónmi,1
796,Mineralokortikoidy v ľudskom organizme:,mobilizujú zdroje energie pri zaťaži,0,"zasahujú do premeny živín, najmä bielkovín",0,vplývajú na hospodárenie so sodíkom a draslíkom,1,výrazne menia priemer ciev a zvyšujú činnosť srdca,0,podnecujú zadržiavanie sodíka v organizme a zvyšujú vylučovanie draslíka,1,vplývajú na metabolizmus glukózy,0,vplývajú na hospodárenie so sodíkom a horčíkom,0,ovplyvňujú vlastnosti mimobunkovej tekutiny,1
797,Sekrécia glukokortikoidov je regulovaná:,z medzimozgu cez neurohypofýzu,0,z medzimozgu cez predný lalok hypofýzy,1,hladinou adrenokortikotropného hormónu,1,hormonálne,1,látkovo,1,z medzimozgu cez zadný lalok hypofýzy,0,z hypothalamo-hypofyzového komplexu,1,z medzimozgu cez adenohypofýzu,1
798,Glukokortikoidy:,sú produkované Langerhansovými ostrovčekmi,0,sú hormóny drene nadobličiek,0,sú hormóny kôry nadobličiek,1,ovplyvňujú metabolizmus bielkovín,1,zvyšujú odolnosť organizmu proti stresu,1,ovplyvňujú premenu bielkovín na cukry,1,tlmiá zápalové procesy,1,pôsobia stimulujúco na tvorbu bielkovín,0
799,Označte správnu odpoveď:,hypothalamus sa po slovensky nazýva podložko,1,neurohypofýza nie je pravá žľaza s vnútorným vylučovaním,1,inzulín je vylučovaný bunkami Langerhansových ostrovčekov zálučkovej žľazy,0,adrenokortikotropný hormón riadi sekréciu glukokortikoidov,1,testosterón riadi dozrievanie folikulov vo vaječníkoch,0,adenohypofýza nie je pravá žľaza s vnútorným vylučovaním,0,neurit je obalený myelínovou pošvou,1,rastový hormón sa tvorí v hypotalame,0
800,Medzi gonádotropné hormóny patrí:,tyreotropný hormón,0,folikuly stimulujúcí hormón,1,FSH,1,somatotropný hormón,0,adrenokortikotropný hormón,0,luteinizačný hormón,1,oxytocin,0,antidiuretický hormón,0
801,Prištítne teleská človeka produkujú:,parathormón,1,tyroxín,0,oxytocín,0,hormón ovplyvňujúci nervovosvalovú dráždivosť,1,hormón regulujúci obsah sodíka v krvi,0,hormón regulujúci obsah draslíka v krvi,0,hormón regulujúci obsah vápníka v krvi,1,"hormón, ktorého nadprodukcia spôsobuje Basedowovu chorobu",0
802,Basedowova choroba:,je spôsobená nadprodukciou hormónu prištítnych teliesok,0,je spôsobená nadprodukciou hormónov štítnej žľazy,1,sa prejavuje zníženým metabolizmom,0,sa prejavuje zvýšeným metabolizmom,1,vzniká v dôsledku nedostatku jódu,0,je spôsobená nadprodukciou tyroxínu,1,je spôsobená nadprodukciou adiuretínu,0,je spôsobená zníženou produkciou adiuretínu,0
803,Ludský neurón:,je bezjadrová bunka so všetkými organellami typickými pre živočíšnu,0,"obsahuje jadro, jadierko ako aj všetky ostatné organely typické pre živočíšnu bunku",1,bol prvýkrát popísaný J.E. Purkyněm,1,okrem tela má početné axóny a dlhý výbežok dendrit,0,je celý obalený myelinovou pošvou,0,je špecializovaná bunka zablokovaná v G0 fáze bunkového cyklu,1,je schopný deliť sa po celý život,0,je podporovaný a vyživovaný gliovými bunkami,1
804,Oblasť dendritov neurónu u ľudí:,"prenáša vzruchy, informácie k nervovým zakončeniam",0,je často bohato vetvená,1,má podpornú a výživovaciu funkciu,0,prijíma informáciu v podobe vzruchu,1,sa označuje ako vstupný úsek,1,sa označuje ako výstupný úsek,0,zabezpečuje vedenie senzitivných vzruchov,1,je obalená myelinovou pošvou,0
805,Vzájomné spojenie nervových buniek v mozgu človeka nazývame:,sylabizmus,0,synagmia,0,synapsia,1,symbióza,0,systola,0,synezmozá,0,synergia,0,synoda,0
806,Označte správnu odpoveď:,synapsia zabezpečuje prenos nervových vzruchov,1,"nervová synapsia je funkčný kontakt medzi membránami dvoch buniek,",1,u človeka je synaptický prenos sprostredkovaný chemicky,1,najdôležitejšie synaptické prenášače u človeka sú adrenalín a noradrenalín,0,počet synapsií v mozgu človeka je rovný počtu neurónov,0,nervové vzruchy pôsobia len povzbudivo,0,nervová synapsia sa vytvára len medzi membránami nervových buniek,0,reflexný dej u človeka je zvyčajne nekontrolovaný,0
807,Mozog dospelého človeka má priemernú hmotnosť:,2500 g,0,1300 g,1,250 g,0,500 g,0,5 kg,0,25 g,0,"0,8 kg",0,750 g,0
808,Vnútorná časť hemisfér predného mozgu človeka je tvorená:,sivou hmotou,0,bielou hmotou,1,bledou hmotou,0,hlavne množstvom nervových vlákien,1,množstvom nervových buniek,0,retikulárnou formáciou,0,mozgovomiechovým mokom,0,hlavne bazálnymi gangliami,0
809,Označte správne tvrdenie:,mozgová kôra riadi vedomú činnosť,1,ložko zriedmozgu je sídlom riadenia činnosti vnútorných orgánov,0,bazálne gangliá sú zúčastňujú na riadení pohybov tela,1,ustredie nepodmienenych sluchových reflexov leží v mozocku,0,rečové centrum je umiestnené v dominantej hemisfére,1,v ľudskom mozgu je viac synapsií ako neurónov,1,počet synapsii v ľudskom mozgu sa odhaduje na 10^14,1,ľudský mozog obsahuje asi miliardu synapsii,0
810,O mozgových komorách človeka platí že:,je ich 5,0,sú 4,1,sú 3,0,"I., II. a III. mozgová komora sú v obidvoch hemisférach predného mozgu",0,I. a II. mozgová komora sú v obidvoch hemisférach predného mozgu,1,len I. mozgová komora je uložená v prednom mozgu,0,len III. mozgová komora je uložená v oblasti medzimozgu,1,medzi mozgovomiechovým mokom v komorách a krvou prebieha výmena látok,0
811,Výkonné funkcie nervovej sústavy sa rozdeľujú na:,ústredná a obvodové,0,ústredná a periférne,0,somatické a vegetatívne,1,somatické a autonómne,1,autonómne a vegetatívne,0,mozgové a miechové,0,vnútorné a vonkajšie,0,hybné a motorické,0
812,Asociačné oblasti mozgovej kôry u ľudí:,majú vzťah k vytváraniu pamäťových stôp,1,sú miestom zakončenia vzostupných dráh receptorov,0,sa nachádzajú v cortex cerebri,1,sú najvyšším centrom vegetatívneho riadenia,0,sú tvorené bazálnymi gangliami,0,sú miestom koordinácií nervových funkcií,1,sú miestom formovania vedomia,1,zabezpečujú homeostázu,0
813,Hlavné ústredie pre riadenie telesnej teploty je u človeka v:,potných žľazách,0,hypothalame,1,pečeň,0,mozocčku,0,autonómnych gangliách,0,prdlíženej mieche,0,podložku,1,koži,0
814,Reticulárna formácia mozgu človeka je tvorená:,"rozsiahlým súborom pospájaných nervových buniek roztrúsených v bielej hmotme, ktorý prestupuje prdlíženou miechou, mostom a stredným mozgom až do medzimozgu",1,"nervovými vláknami, ktoré umožňujú prenos vzruchu medzi mozgom a miechou",0,sieťovitou splet'ou vlákien siahajúcou od miechy až do medzimozgu,0,len vzostupnými nervovými vláknami,0,"nervovými bunkami, ktoré riadia podmienené reflexy",0,"dráhami a nervami, ktoré inervujú oohybné svaly",0,rozptýlenými malzgovými tkanivami,0,len zostupnými nervovými vláknami,0
815,Reticulárna formácia mozgu človeka je dôležitá hlavne pri:,udržani rovnováhy,0,pripojeni všetkých oddielov centrálnej nervovej sústavy,1,riadeni obranných reflexov (kašeľ a kýchanie),0,pri prenose zvukových vĺn kostičkami stredného ucha,0,ovplyvňovaní miechových reflexov,1,ovládaní pohyboch očí,0,udržani pozornosti,1,prebudení zo spánku,1
816,Stredný mozog človeka:,je uložený v tesnom susedstve mostu,1,je  ustredím podmienených čuchových a sluchových reflexov,0,obsahuje centrá V. a VI. hlavového nervu,0,je ústredím podmienených zrakových a sluchových reflexov,0,je ústredím nepodmienených zrakových a sluchových reflexov,1,vytvára štvorhrbole,1,je ústredím nepodmienených čuchových a sluchových reflexov,0,obsahuje centrá III. a IV. hlavového nervu,1
817,Mozoček človeka:,sa podieľa na udržiavani rovnováhy tela a na koordinácii pohybov,1,má na povrchu bielu a vo vnútri sivú hmotu,0,je centrom dýchania,0,dostáva informácie z mozgovej kôry,1,riadi a ovláda činnost' mozgovej kôry,0,má na povrchu sivú a vo vnútri bielu hmotu,1,je najvyšším centrom vegetatívneho riadenia,0,"dostáva informácie zo statokinetického receptorz, z kožných mechanoreceptorov, svalových a šlachových receptorov",1
818,Hlavnou funkciou ľudského mozôčka je:,produkcia hormónov,0,analýza obrazovej informácie,0,regulácia svalového napätia,1,formovanie vedomci činnosti,0,uvedomenie si úmyselných pohybov,0,udržiavanie rovnováhy tela,1,sprostredkovanie obranných reflexov,0,koordinácia pohybových funkcií,1
819,V predlženej mieche človeka sú životne dôležité ústredia:,udržiavania stálej teploty,0,zrakového systému,0,rovnováhy,0,niektorých nepodmienených reflexov,1,riadenia všetkých svalových funkcií a dýchania,0,koordinácie krveného obehu a psychických funkcií,0,riadenia nervových a svalových funkcií,0,obehu krvi a dýchania,1
820,Ústredie dýchacích a srdcovo-cievnych funkcií sú u človeka nachádzajú v:,mozôčku,0,talame,0,predlženej mieche,1,chrbtovej mieche,0,hypotalame,0,mozgovom kore,0,hypofýze,0,strednom mozgu,0
821,Thalamus človeka:,sa po slovensky označuje ako podložko,0,je súčasťou medzimozgu,1,je súčasťou diencephala,1,je súčasťou mesencephala,0,je najvyšším centrom riadenia činnosti vnútorných orgánov,0,má v dolnej časti umiestnené centrum reči,0,je sídlom III. a IV. hlavového nervu,0,riadi celú činnosť endokrinných žliaz,0
822,Zúžovanie a rozširovanie ciev je u človeka nervovo riadené z ústredia v,medzimozgu,0,predlženej mieche,1,hypofýze,0,chrbtovej mieche,0,dominantnej hemisfére,0,aorte,0,retikulárnej formácii,0,mozgovej kôre,0
823,Koľko párov hlavových nervov je u človeka:,7,0,9,0,14,0,16,0,31,0,33,0,11,0,12,1
824,Počet párov miechových nervov človeka je:,12,0,31,1,11,0,14,0,7,0,60,0,nespočetné množstvo,0,22,0
825,Nervové vlákna v mieche človeka:,tvoria bielu hmotu obklopenú šivou hmotou,0,tvoria šivú hmotu obklopujúciu bielu hmotu,0,sú funkčne delia na motorické a senzitívne,1,tvoria početné kanáliky,0,tvoria hustú spleť vyzerajúcu ako kompaktná hmoty,1,tvoria bielu hmotu obklopujúciu šivú hmotu,1,tvoria šivú hmotu obklopenú bielou hmotou,0,sa normálne nevyskytujú,0
826,"K obvodovej, t.j. periférnej nervovej sústave človeka patría:",predlžená miecha a periférne nervy,0,bedrová miecha a centrálna miecha,0,krížové a kostrové nervy,1,krížové a krčné nervy,1,driekové a hrudníkové nervy,1,hlavové nervy,1,miechové nervy,1,hlavové a miechové nervy,1
827,Mozog a miechou človeka obaľuje:,mäkká pleňa,1,tvrdá pleňa,1,pavúčnica,1,cievnatka,1,pia mater,1,medulla,0,arachnoidea,1,dura mater,1
828,Pavúčnica u človeka:,je väzivová bohato prekrvená blana,0,je väzivová málo prekrvená blana,0,je jemná bezcievna blana,1,je obal tesne priliehajúci na povrch mozgu a miechy,0,je blana spájajúca záhyby CNS,1,vytvára srorové telieso,0,sa nazýva aj „bránou vedomia“,0,sa latinsky nazýva arachnoidea,1
829,Vývojovo najmladšou časťou mozgu človeka je:,zadný mozog,0,stredný mozog,0,most,0,mozovček,0,predlžená miecha,0,predný mozog,1,thalamus,0,mesencephalon,0
830,Motorickú inerváciu prečne pruhovaných kostrových svalov človeka,vegetatívne,0,statoakustické,0,miechové,1,hlavové,1,somatické,1,motorické,1,autonomné,0,senzitívne,0
831,Základnou funkčnou jednotkou riadiacej činnosti nervovej sústavy človeka,receptor,0,neurit,0,impulz,0,axón,0,reflex,1,vzruch,0,stres,0,efektor,0
832,Reflexný oblúk u človeka:,je vždy uložený v mieche,0,je priame nervové spojenie receptora s efektorom,0,nemá nikdy časť dráhy uloženú v mozgu,0,má dostredivú a odstredivú časť,1,je nervové spojenie receptora a efektora cez ústrednú nervovú sústavu,1,vzniká ako odpoveď organizmu na dráždenie receptorov,1,obvykle zabezpečuje i kontrolu reflexného deja na princípe spätnej väzby,1,je jednoduchší pri nižšej a zložitejší pri vyššej nervovej činnosti,1
833,Medzi dej a prejavy vyššej nervovej činnosti patrí:,dávivý reflex,0,podmienený reflex,1,nepodmienený reflex,0,učenie,1,stereotypné inštinktívne reakcie,0,emócie,0,umelecká tvorba,1,myslenie a abstrakcia,1
834,Prejavyom nižšej nervovej činnosti u človeka:,sú vrodené reakcie na podnety,1,je lenivosť,0,sú nepodmienené reflexy,1,sú kriminálne činy,0,je alkoholizmus,0,je umelecká tvorivosť,0,je plánovanie,0,je predvídanie,0
835,Hlavným ústredím autonomných funkcií človeka je:,plexus solaris,0,talamus,0,podložko,1,vegetatívne nervstvo hrudníka a brucha,0,hypothalamus,1,blúdivý nerv,0,mozgová kôra,0,predĺžená miecha,0
836,Sympatikus u človeka:,vystupuje z hrudníkovej a driekovej miechy,1,"nepodieľa sa na tvorbe miechových nervov, prebieha mimo nich",1,vystupuje z mozgu a miechy v krížovej oblasti,0,podporuje vylučovanie slín,0,podporuje vylučovanie potu,1,znižuje krvný tlak,0,vyvoláva zvýšenie krvného tlaku,1,vyvoláva zrýchlenie srdcovej činnosti,1
837,Sympatický systém u človeka podporuje či vyvoláva:,rýchlu analýzu sympatii v centrách mozgočka,0,vylučovanie inzulínu,0,vylučovanie adrenalínu,1,akomodáciu oka,0,rozšírenie zrenice,1,prežívanie sympatii k ľudom,0,existenciu emócií,0,vylučovanie hormónov drene nadobličiek,1
838,Parasymoatikus u človeka:,vystupuje iba z mozgu a miechy v krížovej oblasti,1,podporuje zosilnenie pohybu čriev,1,vystupuje z hrudníkovej a driekovej miechy,0,podporuje vylučovanie slín,1,podporuje spomalenie srdcovej činnosti,1,"inervuje väčšinu orgánov spoločne so sympatikom, ale nie je to pravidlom",1,vyvoláva obvykle efekty protichodné voči sympatiku,1,znižuje krvný tlak,1
839,Astigmatizmus je spôsobený:,chybným rohovky,0,akomodáciou šošovky,0,nervovonermým zakalením šošovky,0,splynutím slepej a žltej škvrny,0,rovnomerným pravidelným zakrivením rohovky,0,chýbaním žltej škvrny,0,chýbaním slepej škvrny,0,nervovonermým zakrivením rohovky,1
840,Akomodácia šošovky u človeka:,umožňuje periférne videnie,0,reguluje množstvo svetla vstupujúce do oka,0,je ovládaná závesným aparátom vráskovca,1,"je reflexná, prebieha automaticky",1,umožňuje farebné videnie,0,je reakciou na zmenu osvetlenia,0,súvisí so zmenou jej lomivosti,1,je pripôsobenie sa oka intenzite osvetlenia,0
841,Refrakčné chyby oka človeka môžu spôsúvať:,v nedostatku vitamínu D s následnou šeroslepotou,0,v poruchách optického aparátu oka,1,v zmenách dráždivosti síklovca,0,v predozadnom predĺžení alebo skrátení očnej gule,1,vo zvýšenej optickej lomivosti sietnice,0,v nedostatku vitamínu C,0,v nedostatku rodopsínu,0,v nervonomernom zakrivení rohovky s následným zn,1
842,Podnetom pre zrakový analyzátor človeka sú svetelné vlny s λ v približnom rozsahu:,výlučne 400 - 500 nm,0,40 - 70 nm,0,400 - 700 nm,1,40 - 60 nm,0,4 - 70 nm,0,od 400 nm a vyššie,0,do 300 nm,0,zhodnom ako absorbujú asimilačné farbivá rastlín,1
843,Tyčinky a čapíky ľudského oka sa nachádzajú:,v súkovicí,0,na zadnej vonkajšej ploche očnej gule,0,na zadnej vnútornej ploche očnej gule,1,v sietnici,1,na prednej vonkajšej ploche očnej gule,0,na prednej vnútornej ploche očnej gule,0,na rohovke očnej gule,0,v zrakovej časti mozgovej kôry,0
844,Miestom najostrejšieho videnia u človeka:,slepá škvrna,0,žltá škvrna,1,modrá škvrna,0,šošovka,0,miesto nahromadenia čapíkov v sietnici,1,miesto nahromadenia tyčiniek v sietnici,0,miesto nahromadenia čapíkov v rohovke,0,miesto výstupu zrakového nervu z oka,0
845,Slepá škvrna v ľudskom oku:,"je miesto, kde sú husto nahromadené len tyčinky",0,sa nachádza v oblasti sietnice,1,sa uplatňuje pri videní za tmy,0,sa nachádza v zrenici,0,"je miesto, kde vstupuje do oka zrakový nerv a s ním cievy",1,je miesto najostrejšieho videnia,0,"je miesto, kde nie sú žaidne svetlocitlivé bunky",1,"je miesto, kde sú husto nahromadené len čapíky",0
846,Obsah očnej gule tvorí:,šošovka,1,komorový mok,1,sklovce,1,sklovocvý mok,1,lens crystallina,1,corpus ciliare,0,iris,0,cornea,0
847,Čuchové ústredie človeka sa nachádza:,v spánkovom laloku mozgovej kôry,0,v mozgovej kôre,1,v telencefale,1,v bielej hmote mozgu,0,v sliznici hornej časti nosovej dutiny,0,v strednom mozgu,0,v čelovom laloku mozgovej kôry,1,v kôre temenného laloka,0
848,Proprioreceptory u človeka sa rozhodujúcim spôsobom uplatňujú pri:,"vnímaní chuťových vnemov, patrí k interoreceptorom",0,"vnímaní bolesti, patrí k exteroceptorom",0,"vnímaní pohybov a polohy tela, patrí k interoreceptorom",1,"vnímaní chladu a tepla, patrí k interoreceptorom",0,"vnímaní pohybov a polohy tela, patrí k exteroceptorom",0,"vnímaní pohybov a polohy tela, patrí k streďnému uchu",0,"vnímaní polohy a pohybov tela, nachádzajú sa v kĺboch",1,"vnímaní polohy a pohybov tela, nachádzajú sa vo svaloch a v šľachách",1
849,Základné chuťové vnemy u ľudí sú:,"sladko, horko, kyslo, slano",1,"sladko, kyslo, horúco, slano",0,"sladko, horúco, kyslo, horko",0,"sladko a slano, ostatné sú odvodené",0,"kyslo a slano, ostatné sú odvodené",0,"kyslo, horko, studeno, teplo",0,"horko, horúco, kyslo, slano",0,"sladko, slano, studeno, teplo",0
850,Vlastný chuťový receptor človeka:,je stimulovaný látkami rozpustenými vo vode,1,"neobsahuje chuťové bunky, ktoré sa zúčastňujú na tvorbe výsledného vnemu",1,sú chuťové bunky v chuťových pohárikoch,1,je stimulovaný látkami rozpustenými v hliencoch,0,sa nachádza v sliznici mäkkého podnebia a hltana,1,neposkytuje informáciu o teplote a konzistencii potravy,1,neobsahuje tepelné receptory,1,je menej citlivý ako čuchové bunky,1
851,Signálom pre sluch človeka sú zvukové vlny s frekvenciou:,500 Hz,1,1000 až 3000 Hz,1,20 až 22 000 Hz,0,20 až 23 000 Hz,0,do 1000 Hz,0,16 až 20 000 Hz,1,14 až 700 Hz,0,8 až 12 000 Hz,0
852,Dostredivé sluchové nervové vlákna človeka:,sú aktivované priamo zvukovými vlnami,0,vedú vzruchy do mozgovej kôry,1,vedú vzruchy zo sluchového aparátu uloženom vo vnútornom uchu,1,sú aktivované mechanickým podnetom,1,sú aktivované chemickým podnetom,0,sú aktivované pohybom vlasových buniek Cortiho platne,1,prijímajú priame podnety z ušného bubienka,0,vedú vzruchy zo zmyslových buniek kinetického recepčora,0
853,Označte správne tvrdenie:,"organnum statoakusticus sa anatomicky delí na vonkajšie, stredné a vnútorné ucho",1,"organnum statoakusticus sa anatomicky delí na klavdiku, strmeňok a nákovku",0,"medzi sluchové kostičky patrí: maleus, incus a stapes",0,sluchovými kostičkami sa prenášajú kmity bubienka na stredné ucho,0,sluchovými kostičkami sa prenášajú kmity bubienka na vnutorné ucho,1,"k strednému uchu patrí: bubienková dutina, sluchové kostičky a slimák",0,"k strednému uchu patrí : bubienok, sluchové kostičky a Cortiho platňa",0,Eustachova trubica patrí k vonkajšiemu uchu,0
854,Statoinkinetický receptor:,je tvorený dvoma anatomicky aj funkčne odlišnými typmi receptorov,1,je uložený v spánkovej časti lebky,1,je uložený vo vonkajšom uchu,0,je dôležitý pre vnímanie intenzity a smeru zvuku,0,je dôležitý pre udržanie vzpriameného postoja a rovnováhy,1,sa skladá z kinetickeho a statického receptor,1,je dôležitý pre rozlíšenie zvukov a tónov,0,môže mať poruchy nazývané refrakčné chyby,0
855,Krauseho teliesko je receptorom pre vnímanie:,tlaku a vibrácie,0,chladu,1,bolesti,0,zvuku,0,tepla,0,polohy,0,pohybu,0,pachu,0
856,Ruffiniho teliesko je receptorom pre vnímanie:,zvuku,0,tepla,1,polohy,0,pohybu,0,pachu,0,tlaku a vibrácie,0,chladu,0,bolesti,0
857,Bolesť u človeka:,je vnímaná hmatovými telieskami,0,je vnímaná voľnými nervovými zakončeniami,1,je zvyčajne sprevádzaná zmenami krvného tlaku,1,je zvyčajne sprevádzaná spomalením srdcovej činnosti,0,"je vnímaná nervovými zakončeniami, ktorých je v koži približne 13 na cm²",0,"je vnímaná nervovými zakončeniami, ktorých je v koži približne 50 - 150 na cm²",1,"je vnímaná telieskami, ktorých je v koži približne 50 - 150 na cm²",0,je vnímaná tzv. Ruffiniho telieskom,0
858,Statický receptor u človeka sa nachádza:,,1,v polkruhovitých kanálikoch,0,v mozoku,0,vo vonkajšom zvukovode,0,v gulôvitom vrecúšku a ovláčnom vačku,1,v svalových vretienkach,0,v ovláčnych kanálikoch a gulôvitom vrecúšku,0,v koži stupaj,0
859,Prúdením endolymfy v pokruhovitých chodbjičkác,"su dráždené zmyslové bunky, ktorých vlásky vyčnievajú do statického receptora",0,je dráždený kinetický receptor,1,je rozkmitávaná Cortiho platňa,0,je rozkmitávaný bubienok,0,"je dráždený gulôvitý vačok, v ktorom sú nahromadené zmyslové bunky",0,je dráždeny kineticky a statický receptor,0,je dráždený spánkový lalok mozgovej kôry,0,"sú dráždené zmyslové bunky kinetického receptor, ktorých vlásky
vyčnievajú do dráhy endolymfy",1
860,Na špiči jazyka:,sa nachádza oblasť vnímania kyslej chuti,0,sa nachádza oblasť vnímania slanej chuti,0,sa nachádza oblasť vnímania horekej chuti,0,sa nachádza oblasť vnímania sladkej chuti,1,sa nenachádzajú chuťové poháriky,0,sa nachádza oblasť vnímania koreništej chuti,0,sa nachádzajú chuťové bunky v chuťových pohárikoch,1,sa nachádzajú exteronreceptory,1
861,Menštruačný cyklus ženy rozdeľujeme na:,"detský vek, pubertu, dospelosť, obdobie prechodu a starobu",0,dospelosť a klimax,0,4 fázy,1,"ovuláciu, tehotenstvo a šestonedelie",0,3 fázy,0,ovulačnú a menštruačnú fázu,0,"menštruačnú, proliferačnú, sekrečnú, ischemickú fázu",1,5 fáz,0
862,Žlté teliesko u človeka vzniká:,vývojom žltej krvny v dospelosti,0,účinkom prolaktínu,0,z Graafového folikulu po ovulácii,1,v luteinovej fáze,1,z buniek sliznice maternice vplyvom estrogénov,0,pred ovuláciou,0,v pоovulačnej fáze,1,obyčajne v oboch vajíčnikoch súčasne,0
863,Vaječníky ženy:,produkujú vajíčka,1,vyulúčujú pohlavné hormóny,1,produkujú hlienovitý sekrét zvlhčujúci vstup do pošvy,0,vylučujú androgénne hormóny,0,vylučujú luteinizačný hormón,0,svojimi hormónmi ovplyvňujú aj vývin sekundárnych pohlavných znakov,1,neprodukujú žiadne hormóny,0,vylučujú testosterón,0
864,Grafove folikuly človeka vylučujú:,estrogény,1,progesterón,0,choriongonadotropín,0,testosterón,0,,0,,0,,0,,0
865,Počas pohlavnej zrelosti dozriev v organizme ženy približne:,6000 folikulov,0,1400 folikulov,0,1460 folikulov,0,5000 folikulov,0,2000 folikulov,0,1200 folikulov,0,450 folikulov,1,40 folikulov,0
866,Uvoľnenie vajíčka (ovulácia) nastáva u ženy spravidla:,po skončení uterinného cyklu,0,medzi 14. – 16. dňom ovarialného cyklu,1,28. deň ovarialného cyklu,0,24. deň menštruačného cyklu,0,raz za lunárny mesiac,1,počas menopauzy,0,pravidelne,1,počas menštruácie,0
867,Ľudský Graafov folikul za normálnych okolností v čase po uvoľnení vajíčka:,sa odpluje a nadobúda hubovitú konzistenciu,0,sa môže zmeniť na corpus luteum menstruationis,1,sa resorbuje,0,sa môže zmeniť na corpus luteum graviditatis,1,prechádza do menopauzy,0,produkuje hormóny,1,má funkciu endokrinnej žľazy,1,okamžite podlieha autolytickým zmenám,0
868,K vnútorným ženským pohlavným orgánom patria:,malé pysky ohanbia,0,predsieň pošvy,0,maternica,1,vaječníky,1,clitoris,0,ovarium,1,uterus,1,ovulum,0
869,Vyberte správne tvrdenie o ženských pohlavných orgánoch:,vajíčkovod je párová žľaza mandľovitého tvaru,0,na vaječníku rozišľujeme na povrchu kôru a vo vnútri dreň,1,maternica je nepárový dutý orgán zakončený strapcovitými výbežkami,0,"hymen sa nachádza na začiatku maternice žien, ktoré nemali pohlavný styk",0,mons pubis má podobný erekčný mechanizmus ako mužský pohlavný orgán,0,uterus je svalovo-väzivová trubica vystlaná riadinkovým epitelom,0,labia minora pudendi sú kožné valy kryté chlpmi,0,pošva je ženským kopulačným orgánom,1
870,K vonkajším ženským pohlavným orgánom patria:,ovarium,0,predsieň pošvy,1,vaječníky,0,clitoris,1,maternica,0,miešok,0,uterus,0,malé pysky ohnaňbia,1
