id,question,answer1,isCorrect1,answer2,isCorrect2,answer3,isCorrect3,answer4,isCorrect4,answer5,isCorrect5,answer6,isCorrect6,answer7,isCorrect7,answer8,isCorrect8
393,Záznam zmien elektrického potenciálu srdcového svalu sa označuje ako:,EKG,1,EEG,0,fonogram,0,elektrokardiogram,1,oscilogram,0,elektroencefalogram,0,EMG,0,elektromyelogram,0
394,Meradlom výkonnosti srdca je:,frekvencia tepu,0,minútový objem,1,"množstvo krvi, ktoré srdce vytlačí za minútu",1,"množstvo krvi, ktoré srdce vytlačí pri jednej systole",0,"množstvo krvi, ktoré srdce vytlačí pri jednej diastole",0,"množstvo krvi, ktoré srdce vytlačí pri jednom srdcovom cykle",0,"množstvo krvi, ktoré zaplní celý cievny systém tela",0,celkový objem srdca,0
395,Koronárne tepny:,zabezpečujú výživu srdca,1,odčerpávajú 10 % krvi vytlačenej do aorty pri systole,1,zabezpečujú okysličovanie srdcového svalu,1,sú rozvetvené do rozsiahlej kapilárnej siete,1,vychádzajú z hornej duté žily,0,vychádzajú z aorty,1,vychádzajú z pľúcnic,0,vychádzajú z pravej komory,0
396,Úplne oddelený pľúcny a telový krvný obeh majú:,"živočíchy, ktoré majú jednokomorové srdce",0,vtáky,1,"živočíchy, ktorých srdce je tvorené dvoma predsieňami a jednou komorou",0,cicavce,1,obojživelníky,0,plazy,0,"živočíchy, ktoré majú úplne vyvinutú priehradku medzi srdcovými
komorami",1,"živočíchy, ktorých srdce je tvorené jednou predsieňou a jednou komorou",0
397,Vrátnicový obeh:,je súčasťou pľúcneho krvného obehu,0,je súčasťou telového krvného obehu,1,je svojim charakterom žilový obeh,1,privádza živiny vstrebané do krvi v tráviacich orgánoch do srdca,0,privádza živiny vstrebane´ do krvi v tráviacich orgánoch do pečene,1,začína sieťou kapilár v tráviacich orgánoch,1,vstupuje do pečene vrátnicou,1,začína sieťou kapilár v pečeni,0
398,K vlastnej výmene látkok medzi krvou a tkanivami dochádza:,v tenkostenných tepnách,0,v tepnách s pevnou a pružnou stenou,0,v kapilárach,1,v žilách,0,vo vrátnici,0,v hornej a dolnej dutej žile,0,v srdci,0,v lymfatických uzlinách,0
399,Nervová bunka:,je základná štruktúrna a funkčná jednotka nervovej sústavy živočíchov,1,sa skladá z tela bunky a výbežkov dvojakého typu,1,má jeden odstredivý výbežok - neurit,1,má jeden odstredivý výbežok - dendrit,0,"má dendrity, ktoré privádzajú vzruchy do tela bunky",1,"má dendrity, ktoré vedú vzruchy z tela bunky",0,má dostredivý axón,0,vytvára synapsie s inými nervovými bunkami,1
400,Dostredivé výbežky nervovej bunky:,vedú podráždenie do tela bunky,1,sa nazývajú neuróny,0,vytvárajú spoje s inými bunkami,1,sa nazývajú neurity,0,sa nazývajú dendrity,1,vedú podráždenie z tela bunky,0,sa nazývajú axóny,0,sú krátke a rozvetvené,1
401,Nervové vlákna miechy tvoria:,bielu hmotu obklopujúcu sivú hmotu,1,sivú hmotu obklopenú bielou hmotou,0,bielu hmotu obklopujúcu sivú hmotu,0,sivú hmotu obklopujúcu bielu hmotu,0,aj bielu aj sivú hmotu,0,základ reflexného oblúka,0,miechový kanálik,0,mozgový kmeň,0
402,Miecha:,je centrom zrakových a sluchových reflexov,0,je fylogeneticky najstaršou časťou nervovej sústavy,1,je fylogeneticky najmladšou časťou nervovej sústavy,0,je reflexným centrom regulujúcim pohyb svalov končatín,1,sa podieľa na riadení niektorých autonómnych funkcií,1,je centrom rovnováhy tela,0,ovplyvňuje fyziologické procesy napr. príjímanie potravy,0,sprostredkúva emočné prejavy,0
403,Autonómne nervy:,inervujú vnútorné orgány a cievy,1,vychádzajú z miechy a mozgu,1,vychádzajú len z miechy,0,vychádzajú len z mozgu,0,"sú súčasťou vegetatívnej nervovej sústavy, ktorá je fylogeneticky staršia než sústava somatická",1,"sú súčasťou vegetatívnej nervovej sústavy, ktorá je fylogeneticky mladšia než sústava somatická",0,riadia pohyb kostrových svalov,0,riadia vôľou ovldáné činnosti,0
404,Dôležitou funkčnou vlastnosťou nervových buniek je:,dráždivosť,1,vodivosť,1,schopnosť bunkového delenia,0,schopnosť reagovať na podnety,1,pohyblivosť,0,schopnosť diapedézy,0,schopnosť viesť vzruchy bez zmeny informácie,1,schopnosť kontrakcie,0
405,Stredný mozog cicavcov:,je centrom zrakových a sluchových reflexov,1,podmieňuje vzpriamenú polohu hlavy a tela,1,je najvyšším ústredím koordinácie pohybov,0,reguluje teplotu tela,0,riadi činnosť srdca a obeh telových tekutín,0,sprostredkúva emočné prejavy,0,koordinuje svalový tonus,0,je fylogeneticky najmladšou časťou nervovej sústavy,0
406,Centrum regulujúce spontánne dýchanie je v:,mozôčku,0,predĺženej mieche,1,moste,1,mozgovej kôre,0,zadnom mozgu,1,medzimozgu,0,hypofýze,0,prednom mozgu,0
407,Mozgová kôra:,"má vymedzené oblasti, tzv. korové ústredia",1,okrem primátov je dobre vyvinutá napr. u slona,1,sa začína diferencovať už pri plazoch,1,patrí medzi fylogeneticky mladšiu časť nervovej sústavy,1,tvorí pri vtákoch len tenkú vrstvu,1,má povrch zvrásnený len pri evolučne starších cicavcoch,0,sústreďuje informácie prichádzajúce len z okolia organizmu,0,má čuchové receptory,0
408,Mozgovú kôru majú najviac vyvinutú:,primáty,1,plazy,0,žraloky a delfíny,0,slony a delfíny,1,cicavce,1,vtáky,0,obojživelníky,0,ryby,0
409,Mozôček:,kontroluje rovnováhu tela a koordinuje pohyby,1,je centrom dýchania,0,je ústredím pre kýchanie,0,je ústredím reflexných pohybov,0,riadi činnosť mozgovej kôry,0,sprostredkúva reakcie na bolesť a chlad,0,je najvyšším ústredím autonómnych funkcií,0,prijíma signály z analyzátorov vnútorného ucha a svalov,1
410,Nadradenou časťou nervového riadenia vnútorných orgánov je:,talamus,0,hypotalamus,1,predĺžená miecha,0,predný mozog,0,mozôček,0,mozgová kôra,0,podlôžko,1,lôžko,0
411,Prejavom nižšej nervovej činnosti:,sú vrodené reakcie na podnety,1,sú nepodmienené reflexy,1,sú získané reakcie na podnety,0,sú podmienené reflexy,0,je učenie,0,sú inštinkty,1,sú emócie ,1,je strach ,1
412,Podmienený reflex:,je vrodený,0,je prejavom vyššej nervovej činnosti,1,je základom vývoja inštinktívneho správania,0,je získaný počas ontogenézy jedinca,1,je získaný počas fylogenézy,0,"vedie k vytváraniu nových, dočasných nervových spojení",1,patrí k základným mechanizmom učenia,1,nevyžaduje pre svoj vznik nácvik,0
413,Medzi vyššiu nervovú činnosť patrí:,podmienený reflex,1,nepodmienený reflex,0,učenie,1,inštinkt,0,strach,0,myslenie,1,rodičovský inštinkt,0,pamäť,1
414,Fagocytóza:,patrí k prejavom bunkovej imunity,1,je vrodená a nešpecifická,1,patrí k prejavom protilátkovej špecickej imunity,0,patrí k prejavom celulárnej špecifickej imunity,0,je vývojovo mladším typom imunitnej reakcie,0,je vývojovo starším typom imunitnej reakcie,1,sa vyvinula z pôvodného mechanizmu výživy jednobunkových organizmov,1,je obranný mechanizmus spoločný pre všetky skupiny živočíchov,1
415,Bunkovú špecifickú imunitnú reakciu zabezpečujú:,B lymfocyty,0,neutrofilné granulocyty,0,T lymfocyty,1,plazmatické bunky,0,monocyty,0,trombocyty,0,lymfocyty,1,"lymfocyty, ktoré dozrievajú v týmuse",1
416,Objaviteľ fagocyózy bol:,P. Ehrlich,0,I. I. Mečnikov,1,I. M. Sečenov,0,I. P. Pavlov,0,N. Tinbergen,0,L. Pasteur,0,W. Harvey,0,S. W. Fox,0
417,Najlepšie vyvinutý sluch so schopnosťou vnímať aj ultrazvukové signály majú:,mačkovité mäsožravce,0,netopiere,1,veľryby,1,psovitě mäsožravce,0,ryby,0,larvy obojživelníkov,0,hmyz,0,obratlovce,0
418,Protilátky:,sa vytvárajú v plazmatických bunkách po styku B lymfocytov s antigénom,1,sú bielkoviny a reagujú len s určitým antigénom,1,reagujú len s antigénom produkovaným B lymfocytmi,0,sa vytvárajú v T lymfocytoch,0,sa vytvárajú v T lymfocytoch po styku s antigénom,0,"sú imunoglobuliny a reagujú len s určitým antigénom, ktorý vyvoláva ich tvorbu",1,sú antigény špecifické pre daný organizmus,0,sú polysacharidy produkované B lymfocytmi,0
419,Protilátková špecifická imunitná reakcia:,je zabezpečovaná tvorbou protilátok v T lymfocytoch,0,je vývojovo mladšia ako nespecifická imunita,1,je sprostredkovaná B lymfocytmi,1,je zabezpečovaná tvorbou protilátok antigénom,0,je zabezpečovaná tvorbou protilátok plazmatickými bunkami,1,je zabezpečovaná tvorbou aglutinogénov,0,"je zabezpečená protilátkami, ktoré produkujú monocytv",0,"je zabezpečená protilátkami, ktoré produkujú fibroblasty vznikajúce z T lymfocytov",0
420,Označte správne odpovede:,funkcia protilátok je zneškodňovať vírusy a baktériálne toxíny,1,bunkovú špecifickú imunitu zabezpečujú T lymfocyty,1,fagocytóza patrí k prejavom nespecifické bunkovej imunity,1,špecifická imunita sa vyskytuje už u článkonožcov,0,pasívna imunizácia môže byť zabezpečovaná aj materským mliekom,1,aktívna imunizácia organizmu vzniká po prekonaní infekčného ochorenia,1,fagocytóza patrí k prejavom protilátkovej imunity,0,bunkovú špecifickú imunitu zabezpečujú B lymfocyty,0
421,Proprioreceptory:,sú receptory nachádzajúce sa vo svaloch a šľachách,1,sú exteroreceptory,0,sú interoreceptory,1,informujú o polohe častí tela,1,informujú o zmenách vonkajšieho prostredia,0,sú pomocné orgány interoreceptorov,0,sú v princípe rádioreceptory,0,pomahajú živočíchom orientovať sa ,0
422,Medzi chemoreceptory patria:,sluchové receptory,0,chuťové receptory,1,čuchové receptory,1,receptory rovnováhy,0,fotoreceptory,0,receptory kože,0,receptory citlivé na viditeľné svetlo,0,tepelné receptory,0
423,Rádioreceptory:,"delíme na fotoreceptory, termoreceptory a vlastné rádioreceptory",1,určitého typu sú vyvinuté už pri jednobunkovcoch,1,umožňujú niektorým živočíchom reagovať na magnetizmus,1,môžu registrovať ionizujúce žiarenie,1,všetkých typov má dokonale vyvinuté človek,0,môžu reagovať na zmenu chemického zloženia prostredia,0,umožňujú živočíchom orientovať sa v priestore napr. pri sezónnej migrácii,1,reagujú na zvukové podnety,0
424,Statocysta je ústrojom rovnováhy:,kôrovcov,1,hmyzu,0,stavovcov,0,ryb,0,cicavcov,0,mäkkýšov,1,plazov,0,vtákov,0
425,Statokinetický orgán:,poskytuje informácie o polohe a pohybe tela,1,cicavcov je uložený vo vnútornom uchu,1,majú raky uložený na báze tykadiel,1,"obsahuje receptorové bunky s citlivými brvami, reagujúcimi na mechanické dráždenie",1,obsahuje Cortiho bunky,0,obsahuje receptorové bunky reagujúce na zmeny teploty,0,je tympanálny orgán kobyliiek,0,je dráždený svetelnými podnetmi,0
426,"Receptorové bunky, meniace zvukový podnet na nervový signál sa nachádzajú:",pri rybách v bočnej čiare,1,pri cicavcoch v Cortiho orgáne vnútorného ucha,1,pri hmyze v tympanálnych orgánoch,1,pri cicavcoch v Cortiho orgáne vonkajšieho ucha,0,pri vtákoch v ušnom bubienku,0,pri cicavcoch v strednom uchu,0,pri bezstavovcoch v statocyste,0,pri vtákoch a cicavcoch v spoločnom sluchovopolohovom orgáne,1
427,Hmyz má oči:,komorové,0,zložené,1,facetové,1,ploché,0,miskovité,0,pohárikovité,0,teleskopické,0,zložené z omatídií,1
428,Chemoreceptory:,radia chemické reakcie,0,čuchové veľrybám chýbajú,1,čuchové majú dobre vyvinuté psy a kone,1,chuťové sú uložené v chuťových pohárikoch,1,nie sú vyvinuté pri hmyze,0,chuťové sú tzv. diaľkové chemoreceptory,0,analyzujú prítomnosť chemických látok v ovzduší a vode,1,sú najčastejšie umiestnené vo vnútorných orgánoch,0
429,Ektotermné živočíchy sú:,živočíchy s premennlivou teplotou tela,1,"živočíchy, ktorých telesná tepota sa mení v závislosti na teplote prostredia",1,"živočíchy, ktorých telesná tepota je stálá",0,"živočíchy, ktorých telesná tepota nezávisí od teploty okolia",0,niektoré bezstavovce a všetky stavovce,0,napr. drsnokožce,1,všetky bezstavovce,1,plazy,1
430,Endotermia znamená:,stálú telesnú teplotu nezávislú od teploty prostredia,1,stálú telesnú teplotu závislú od teploty prostredia,0,premennlivú telesnú teplotu nezávislú od teploty prostredia,0,prehriatie organizmu,0,zníženie produkcie tepla organizmom,0,podchladenie organizmu,0,že živočíchy sú schopné regulovať tvorbu tepla v teplnom jadre organizmu,1,že živočíchy sú schopné regulovať tvorbu tepla v tepelnom obale organizmu,0
431,Medzi endotermné živočíchy patria:,hmyz,0,obrúčkavce,0,cicavce a vtáky,1,plazy,0,obojživelníky,0,drsnokožce,0,ryby,0,všetky bezstavovce,0
432,Fyzikálna termoregulácia sa uskutočňuje:,rozšírením kožných ciev a odparovaním,1,zvýšeným príjmom potravy,0,výdajom tepla vyžarovaním a prúdením,1,pôsobením hormónov štítnej žľazy,0,zvýšením intenzity metabolizmu,0,pôsobením hormónov drena nadobličiek,0,aktivizáciou svalových pohybov,0,zmenou prietoku krvi v koži,1
433,Hibernanty:,patria medzi heterotermné organizmy,1,"sú napr. jež, plch, sysel",1,"sú napr. krt, medveď, netopier",0,upadajú do zimného spánku pri trvalom poklese teploty prostredia pod 0°C,0,čerpajú počas hibernácie energiu zo zásoby tuku,1,upadajú do zimného spánku pri trvalom poklese teploty prostredia pod 10°C,1,počas zimného spánku zvyšujú teplotu tepelného jadra organizmu,0,si zabezpečujú prežitie za nepriaznivých podmienok zvýšením aktivity metabolizmu,0
434,Hlavným producentom tepla pri endotermných živočíchoch:,sú kostrové svaly,0,je mozog,0,je pečeň,1,je podkožný tuk,0,sú endokrínné žľazy,0,sú oblúčky,0,je dýchacia sústava,0,je tenké črevo,0
435,Estivácia je:,prebytok potravy a nedostatok vody,0,letný spánok,1,zvýšenie telesnej teploty živočícha,0,prehriatie organizmu pri väčších změnach teploty prostredia,0,typická pre niektoré púštne a stepné živočíchy,1,typická pre živočíchy polárnych oblastí,0,vyvolávaná nedostatkom vody a potravy vplyvom vysokých teplôt prostredia,1,zimný spánok,0
436,Heterotermia znamená:,prispôsobovanie sa teplote prostredia živočíchov so stálou telesnou teplotou,1,prispôsobovanie sa teplote prostredia živočíchov ektotermných,0,zvýšený bazálny metabolizmus za nepriaznivých podmienok,0,že v prípade nepriaznivej teploty prostredia sa endotermné živočíchy stávajú dočasne ektotermnými,1,že nastupuje fyzikálna termoregulácia,0,že nastupuje chemická termoregulácia,0,prispôsobovnanie sa teplote prostredia živočíchov s premenlivou telesnou teplotou,0,že organizmus má premenlivú teplotu tela nezávisle na teplote prostredia,0
437,Epifýza:,"produkuje hormón, ktorý brzdí tvorbu pohlavných hormónov",1,"produkuje hormón, ktorý aktivuje tvorbu pohlavných hormónov",0,je funkčnou súčasťou hypofýzy,0,produkuje rastový hormón,0,reaguje na intenzitu svetla,1,produkuje melatonín,1,produkuje melanín,0,produkuje melanotropný hormón,0
438,Hormóny štítnej žľazy:,ovplyvňujú intenzitu metabolizmu,1,sú tyroxín a tyronín,1,"sú stavebnými látkami
",0,patria medzi gestagény,0,sa vytvárajú v hypofýze,0,"udržiavajú vhodnú koncentráciu iónov sodíka v krvnej plazme
",0,podmieňujú vytvorenie dokonalej obrany organizmu sodíka v krvnej plazme,0,regulujú napr. metamorfózu obojživelníkov,1
439,Hormóny hmyzu:,sú produkované neurosekrečnými bunkami hlavového ganglia,1,sú produkované žľazami nachádzajúcimi sa v hrudi,1,môžu byť uvoľňované do vonkajšieho prostredia ako feromóny,1,riadia procesy spojené s dokonalou alebo nedokonalou premnou,1,môžu mať vnútrodruhovú komunikačnú funkciu,1,sú produkované Malpighiho žľazami,0,sú distribuované do tkanív krvou,0,sú uvoľňované do uzavretého lymfatického cievneho systému,0
440,Príštitné telieska sa prvýkrát objavujú pri:,cicavcoch,0,hmyze,0,obojživelníkoch,1,vtákoch,0,rybách,0,bezstavovcoch,0,mäkkýšoch,0,plazoch,0
441,Inzulín:,znižuje hladinu glukózy v krvi,1,zvyšuje ukladanie glykogénu v pečeni a svaloch,1,zvyšuje hladinu glukózy v krvi,0,urýchľuje rozklad glykogénu v pečeni,0,zvyšuje tvorbu tukov v pankrease,0,znižuje ukladanie glykogénu v pečeni a svaloch,0,ovplyvňuje metabolizmus sacharidov opačne ako glukagón,1,podporuje zvýšené zužitkovanie glukózy v bunkách,1
442,Hormóny:,pôsobia nespecificky na bunky cieľových tkanív,0,pôsobia specificky na bunky cieľových tkanív,1,sú stavebnými látkami,0,sú zdrojom ATP,0,sú záčastníkujú procesotýnčzy,0,vylúčené do telových tekutín sú aktívne niekoľko minút alebo dní,1,"sú vysoko účinné organické látky, ktoré ovplyvňujú činnosť telesných orgánov",1,pôsobia ako regulátory látkovej premeny,1
443,Hormonálne regulačné mechanizmy:,sa uplatňujú už pri bezstavovcoch,1,sa najskôr objavujú pri stavovcoch,0,pri stavovcoch sa odlišujú od hormonálnych regulácií pri bezstavovcoch,1,pri stavovcoch sa nelíšia od hormonálnych regulácií pri bezstavovcoch,0,sú pri bezstavovcoch nahradené nervovou reguláciou,0,sú rýchlejšie ako nervové regulácie,0,sú pomalšie ako nervové regulácie,1,sú priamo ovplyvňované aj nervovým systémom,1
444,Feromóny hmyzu:,vyvolávajú agresivitu,0,"vyvolávajú únikové reakcie
",1,spôsobujú ospanlivosť,0,vyvolávajú obranné reakcie,1,spôsobujú pri hmyze spomalenie rastu,0,zabraňujú premene hmyzu,0,majú vplyv na metabolizmus hmyzu,0,vyvolávajú pohlavnú aktivitu,1
445,Predný lalok hypofýzy stavovcov:,produkuje hormón prolaktín,1,produkuje melatonotropný hormón,0,sa nazýva adenohypofýza,1,sa nazýva neurohypofýza,0,produkuje hormóny riadiace činnosť nadobličiek,1,produkuje rastový hormón,1,produkuje hormón vazopresín,0,produkuje hormón oxytocin,0
446,K výskumným oblastiam zaoberajúcim sa poznávaním správania zvierat patrí:,výskum fyziológie podmienečných reflexov,1,skúmanie procesu učenia u zvierat v laboratórnych podmienkách ,1,behaviorizmus,1,etológia,1,výskum správania živočíchov v prirodzenom prostredí,1,anatómia,0,cytológia ,0,skúmanie fyziológie prenosu nervového signálu ,0
447,Komunikačné signály živočíchov:,môžu byť akustické alebo optické,1,majú identifikačnú alebo výstražnú funkciu,1,môžu byť dotykové alebo elektrické,1,sa uplatňujú napr. pri obrane teritória,1,neovplyvňujú správanie iných príslušníkov druhu,0,nie sú súčasťou sociálneho správania,0,slúžia na prenos informácie,1,nemajú informačnú funkciu,0
448,Inštinktívne správanie živočíchov:,je predmetom skúmania etológie,1,je predmetom skúmania evobiológie,0,je vrodené správanie vyvolávané endogénnymi alebo exogénnymi podnetmi,1,"je správanie, ktorého základom sú nepodmienené reflexy",1,"je správanie, ktorého základom sú podmienené reflexy",0,je napr. obranné a útekové správanie,1,zahŕňa schopnosť generalizácie,0,je napr. komfortné správanie,1
449,Teritoriálne správanie živočíchov:,je vrodené inštinktívne správanie,1,umožňuje živočíchom zabezpečiť si dostatočné množstvo potravy,1,zabezpečuje rozptyl živočíchov v biotope,1,znižuje možnosť vnútrodruhových konfliktov,1,je spojené predovšetkým s obranou teritória pred príslušníkmi iných živočíšnych druhov,0,je spojené predovšetkým s obranou teritória pred príslušníkmi vlastného druhu,1,zahŕňa označovanie a obranu vlastného teritória,1,je rozmnožovacie správanie,0
450,Fakultatívne učenie:,prebieha len v ranom veku živočíchov,0,nie je vekovo obmedzené,1,prebieha prakticky po celý život jedinca,1,vedie k zdokonaľovaniu činnosti živočícha,1,je napr. vpečatenie,0,je prispôsobenie sa endogénnym biologickým rytmom,0,je základom obranných reakcií mláďat,0,prebieha na základe nepodmienených reflexov ,0
451,Detský chrup má:,"20 zubov, prvĕ sa pravidelne prerazávajú stoličky vo veku okolo jedného",0,"20 zubov, prvĕ sa obyčajne prerazávajú rezáky vo veku okolo 6. mesiaca",1,"22 zubov, prvĕ sa obyčajne prerazávajú stoličky vo veku okolo jedného",0,"20 zubov: 8 rezákov, 4 očné zuby a 8 stoliček",1,"18 zubov, prvĕ sa pravidelne prerazávajú rezáky vo veku okolo 6. mesiaca",0,"všetky zuby dočasné, tzv. mliečne",1,"20 zubov: 8 rezákov, 4 črenové zuby a 8 stoliček",0,"24 zubov, prvĕ sa obyčajne prerazávajú rezáky vo veku okolo 6. mesiaca",0
452,Vyvinutý mliečný chrup dieťa'ta má:,4 stoličky,0,4 črenové zuby,0,8 rezákov,1,4 očné zuby,1,8 stoličiek,1,32 zubov,0,20 zubov,1,nevyvinuté očné zuby,0
453,Ktoré zuby chýbajú v detskom chrupre:,rezáky,0,očné zuby,0,črenové zuby,1,mliečne zuby,0,všetky stoličky,0,8 črenových zubov,1,4 stoličky,1,2 rezáky,0
454,Do ústnej dutiny ústia:,3 páry veľkých slinných žliaz,1,malé a veľké tráviace žľazy,0,"3 veľké slinné žľazy, ktoré produkujú sliny iba pri vyvolaní podmienehého",0,príušné žľazy produkujúce sliny s obsahom ptyalínu,1,podjazykové žľazy produkujúce sliny s obsahom amyláz,0,poduškové žľazy produkujúce sliny s obsahom ptyalínu,0,"3 páry veľkých slinných žliaz produkujúce sliny, ktoré obsahujú",1,"3 páry veľkých slinných žliaz - podjazykové, poduškové, príušné",1
455,V ústnej dutine človeka:,končí trávenie škrobov,0,žijú baktérie,1,začína vstrebávanie niektorých látok,1,nachádzame ptyalín,1,začína trávenie polysacharidov,1,nachádzame amylázu,1,"nachádzame v slinách baktericídne látky, napr. lyzozóm",0,dochádza k mechanickému rozdrobovaniu potravy,1
456,Pôsobením žalúdkovej šťavy sa u ľudí štiepia:,pepsinogén na pepsin,0,bielkoviny pôsobením chymozínu,0,a detoxikujú príjaté látky,0,sacharidy pôsobením pepsínu,0,aminokyseliny pôsobením pepsínu,0,bielkoviny,1,niektoré tuky pôsobením žalúdčnej lipázy,1,niektoré tuky pôsobením pankreatickej lipázy,0
457,Ktorá zložka žalúdkovej šťavy stabilizuje vitamíny skupiny B a vitamín C?,HCl,1,"HCl, ktorá vytvára v žalúdku silne alkalické prostredie potrebné na",0,pepsin vylučovaný vo forme neaktívneho pepsinogénu,0,hlien,0,"mucin, ktorý vylučujú hlienové žliazky pri vchode do žalúdka a v jeho",0,kyselina chlorovodíková,1,"kyselina chlorovodíková, ktorá vytvára v žalúdku silne alkalické prostredie",0,"kyselina chlorovodíková, ktorá vytvára v žalúdku silne kyslé prostredie",1
458,Žalúdočná šťava obsahuje:,"pepsin, ktorý je vylučovaný vo forme neaktívneho pepsinogénu",1,"HCI, ktorá vytvára v žalúdku silne kyslé prostredie",1,"mucin, ktorý vylučujú hlienové žliazky pri vchode do žalúdka",1,"pepsin, ktorý je vylučovaný vo forme neaktívneho trypsinogénu",0,"alkalický hlien, ktorý zabraňuje znehodnoteniu vitamínov skupiny B",0,vodu,1,"kyslý hlien, ktorý pokrýva steny žalúdka a tým ich chráni pred účinkami HCl",0,"gastrín, úlohou ktorého je aktivovať pepsinogén na pepsin",0
459,Vrátnikový zvierač u človeka sa nachádza:,medzi pažerákom a žalúdkom,0,medzi žalúdkom a dvanástnikom,1,medzi žalúdkom a tenkým črevom,1,medzi žalúdkom a hrubým črevom,0,na výustení žlčovodu,0,na výustení vývodu pankreasu,0,medzi žalúdkom a bedrovňou,0,na výustení hrubého čreva,0
460,Úplný rozklad živín nastáva:,v tenkom čreve,1,v žalúdku pôsobením pepsinu,0,v hrubom čreve pôsobením hnilobných baktérií,0,v pečeni,0,"v tenkom čreve pôsobením pankreatickej šťavy, žlče a črevnej šťavy",1,"v tenkom čreve pôsobením pepsinu, lipázy a amylázy",0,"v hrubom čreve pôsobením trypsínu, lipázy, amylázy a enzýmov črevnej šťavy",0,"v žalúdku pôsobením pepsinu, amylázy a žalúdočnej lipázy",0
461,Ptyalín je enzým:,prítomný v žalúdočnej šťave,0,vylučovaný príušnými žľazami,1,prítomný v slinách,1,natrávujúci polysacharidy v ústnej dutine,1,ktorý štiepi bielkoviny v ústnej dutine,0,prítomný v črevnej šťave,0,ktorý má baktericídne účinky,0,ktorý začína rozkladať bielkoviny v ústnej dutine,0
462,Chymozín je:,enzým žalúdka dojčiat zrážajúci mlieko,1,kyslá trávenina,0,natrávená potrava,0,enzým chymusu,0,enzým žalúdočnej šťavy,1,žalúdočná lipáza,0,enzým tenkého čreva dojčiat zrážajúci mlieko,0,"alkalický hlien, ktorý pokrýva steny žalúdka",0
463,Trypsín u človeka:,"sa tvorí v pankrease, v žalúdku štiepi bielkoviny na peptidy až aminokyseliny",0,"pochádza z pankreasu, v tenkom čreve štiepi polypeptidy na peptidy a aminokyseliny",1,"sa tvorí v zrazkách žalúdka, kde štiepi bielkoviny na polypeptidy",0,"sa tvorí v pankrease, v tenkom čreve štiepi tuky na glycerol a mastné kyseliny",0,je proteolytickým enzýmom,1,prichádza do dvánastníka v podobe neaktívneho pepsinogénu,0,prichádza do dvánastníka v podobe neaktívneho trypsinogénu,1,je pankreatickým hormónom,0
464,Aké tráviace enzýmy vylučuje človek do hrubého čreva:,kvasné,0,lipázu,0,amylázu,0,trypsin,0,,1,,0,,0,,0
465,Hrubé črevo človeka sa začína:,zostupnou časťou,0,slepým črevom a pokračuje výstupnou časťou,1,ako slepé črevo,1,ako slepé črevo v ľavej bedrovej jame,0,ako slepé črevo v pravej bedrovej jame,1,ako dvanástnik v pravej bedrovej jame,0,ako slepé črevo a končí sa bedrovnikom,0,ako slepé črevo a konči sa konečnikom,1
466,Jemné výbežky sliznice tenkého čreva človeka umožňujúce lepšie vstrebávanie živín sú:,drobné žliazky produkujúce črevnú šťavu,0,riasy,0,klky,1,kruhovité zvrásnenia - mikroklky,0,lalôčiky,0,riasinky,0,ostrovčeky,0,brvy,0
