id,question,answer1,isCorrect1,answer2,isCorrect2,answer3,isCorrect3,answer4,isCorrect4,answer5,isCorrect5,answer6,isCorrect6,answer7,isCorrect7,answer8,isCorrect8
1,Prokaryotická bunka:,môže obsahovať tylakoidy,1,"môže obsahovať choloplasty, napr. sinice",0,obsahuje prokaryotické ribozómy,1,má cytoplazmatickú membránu,1,má nukleoid,1,má lineárne molekuly DNA uložené v cytoplazme,0,má vnútorný priestor rozčlenený membránami na štruktúrne a funkčné celky,0,má homologické kruhové chromozómy uložené voľne v cytoplazme,0
2,Prokariotické bunky nemajú:,plastidy,1,vnútorný priestor rozčlenený membránami na štruktúrne a funkčné celky,1,ribozómy,0,diktyozómy,1,cytoplazmatickú membránu,0,centriol,1,jadierko,1,mitochondrie,1
3,Ktoré štruktúry prokaryotickej bunky sú zodpovedné za uvoľňovanie energie:,tylakoidy,0,bičíky,0,ribozómy,1,mitochondrie,0,plazmatická membrána,1,jadro,0,diktyozómy,1,vakuoly,0
4,Cytológia sa zaoberá štúdiom:,živých sústav na úrovni molekúl,0,mikroskopickej stavby živočíšnych tkanív,0,javov na úrovni bunky,1,živých mikroorganizmov,0,živých sústav na úrovni ich základnej štruktúrnej a funkčnej jednotky,0,vírusov,0,tvaru a štruktúry buniek a bunkových organel,0,makromolekulových látok,0
5,Za najmenší systém schopný samostatného života sa považuje:,vírus,0,bunka,1,kolónia,1,biopolymér,0,mnohobunkový organizmus,1,populácia,0,nukleoproteínová častica,1,indivíduum vyššieho rádu,1
6,Vírusy sú:,extracelulárne parazity,0,schopné uchovávať genetickú informáciu,1,nebunkové organizmy,1,najjednoduchšie jednobunkové prokaryotické organizmy,0,z hľadiska organizácie najjednoduchšie živé sústavy,1,schopné autoreprodukcie,0,schopné trvalo existovať len ako parazity buniek,1,rozmnožovaním viazané len na živé bunky,1
7,Podľa všeobecnej štruktúry rozlišujeme dva základné typy buniek:,rastlinné a živočíšne,0,jadrové a bezjadrové,0,diferencované a nediferencované,0,prokaryotické a eukaryotické,1,mikroskopické a submikroskopické,0,jednoduché a zložené,0,membránové a nemembránové,0,telové a pohlavné,0
8,Pravé individuá vyššieho rádu:,sú spoločenstvá tzv. sociálneho hmyzu,1,sú napr. svorky vlkov,0,"sú spoločenstvá jedincov, ktorí môžu existovať aj samostatne",0,sú obligátne spoločenstvá organizmov,1,majú jedincov trvalo anatomicky a funkčne diferencovaných,1,"sú spoločenstvá organizmov, v ktorých je funkčná špecializácia jedincov zameniteľná",0,"sú spoločenstvá organizmov, v ktorých je funkčná špecializácia jedincov nezameniteľná",1,majú jedincov prechodne anatomicky a funkčne diferencovaných,0
9,Bunky určitého funkčného a štruktúrneho typu sa spájajú do:,orgánov - pri rastlinách,0,špecializovaných buniek,0,pletív - pri rastlinách,1,organizmov,0,individuí vyššieho rádu - pri živočíchoch,0,tkanív - pri živočíchoch,1,tkaninových kultúr - pri rastlinách,0,bunkových organel,0
10,Základom cytoplazmatickej membrány je,bielkovinová dvojvrstva,0,celulózová dvojvrstva,0,"dvojvrstva lipidov, do ktorej sú ponorené bielkoviny",1,cytosol,0,cytoplazmatická matrix,0,fosfolipidová dvojvrstva,1,plazmaléma,0,"bielkovinová dvojvrstva, do ktorej sú ponorené fosfolipidy",0
11,K základným bunkovým povrchom eukaryotickej bunky patrí:,plazmaléma,1,jadrová membrána,0,kutikula,0,pelikula,0,bunková stena,1,cytoplazmatická membrána,1,slizové puzdro,0,karyoléma,0
12,Cytoplazmatická membrána:,je väčšinou jedinou biomembránou v prokaryotických bunkách,1,reguluje príjem látok do bunky,1,sa nazýva plazmaléma,1,sa nazýva karyoléma,0,patrí k bunkovým povrchom,1,obsahuje receptory na zachytávanie signálov,1,tvorí prostredie pre život a metabolickú aktivitu bunkových organel,0,zabezpečuje predovšetkým mechanickú ochranu bunky,0
13,Biomembrány sú zložené:,z dvojvrstvy bielkovín a molekúl sacharidov,0,z dvojvrstvy lipidov a integrálnych a periférnych bielkovín,1,z dvojvrstvy fosfolipidov a dvojvrstvy sacharidov,0,z jednej vrstvy fosfolipidov a dvoch vrstiev molekúl bielkovín,0,"z molekúl fosfolipidov, ktoré tvoria dvojitú vrstvu a molekúl bielkovín",1,z vonkajšej bielkovinovej a vnútornej lipidovej vrstvy,0,z integrálnych a periférnych lipidov a molekúl bielkovín,0,"z dvojvrstvy fosfolipidov, do ktorej sú ponorené molekuly bielkovín",1
14,Eukaryotické bunky na rozdiel od prokaryotických:,majú membránové organely,1,nemajú membránové organely,0,majú karyolému,1,nemajú jadrovú membránu,0,majú kruhové jadrové chromozómy,0,sú spravidla menšie,0,majú vnútorný priestor rozčlenený membránami na štruktúrne a funkčné celky,1,majú vlastný genetický materiál,0
15,Živočíšne bunky na rozdiel od rastlinných buniek:,sú od vonkajšieho prostredia oddelené cytoplazmatickou membránou,0,"obsahujú lyzozómy, ktoré zabezpečujú rozkladné procesy v bunke",1,obsahujú vakuoly,0,majú na povrchu semipermeabilnú bunkovú stenu,0,sú navzájom pospájané plazmodezmami,0,nemajú bunkovú stenu,1,majú tonoplast,0,"môžu obsahovať myofibrily, tonofibrily, neurofibrily",1
16,Cytoskelet bunky:,zabezpečuje priestorové rozloženie organel v bunke,1,predstavuje statickú kostru bunky,0,uplatňuje sa pri realizácií difúzie,0,uplatňuje sa pri realizácií fagocytózy,1,uplatňuje sa pri realizácií pinocytózy,1,uplatňuje sa pri realizácií osmózy,0,je zložený z nukleoproteínových vlákien,0,"má pohybovú, mechanickú a podpornú funkciu",1
17,Cytoskeletová sústava bunky:,patrí k membránovým štruktúram,0,"uplatňuje sa pri realizácii všetkých druhov pohybov, ktoré bunka vykonáva",1,predstauje dynamickú kostru bunky,1,predstavuje statickú kostru bunky,0,patrí k fibrilárnym štruktúram,1,patrí medzi neživé súčasti bunky,0,"je tvorená mikrotubulmi, mikrofilamentami a intermediárnymi filamentami",1,je tvorená nukleoproteínovými vláknami,0
18,Drsná forma endoplazmatického retikula:,sa podieľa na syntéze vitamínu D,0,sa podieľa na syntéze lipidov,0,je bez ribozómov,0,sa podieľa na syntéze bielkovín,1,sa paľeido na syntéze proteínov,1,zabezpečuje vnútrobunkový transport látok,1,zabezpečuje medzibunkový transport látok,1,nepatrí k mebránovým organelám bunky,0
19,Hladká forma endoplazmatického retikula:,je bez ribozómov,1,je viditeľná na mikroskope,0,sa podieľa na syntéze lipidov,1,sa podieľa na syntéze vitamínu D,1,obsahuje predovšetkým hydrolytické enzýmy,0,má ribozómy iba na vnútornej membráne,0,sa podieľa na syntéze bielkovín,0,zabezpečuje vnútrobunkový transport niektorých látok,1
20,Lyzozómy obsahujú enzýmy:,ktoré sa zúčastňujú na lytických procesoch v bunke,1,ktoré sa zúčastňujú na vnútrobunkovom trávení,1,typu polymeráz,0,tráviace a vylučovacie,0,"ktoré upravujú látky syntetizované na riboomoch, aby mohli byť vylúčené z bunky von",0,uložené v matrix,0,hydrolitické,1,"ktoré štiepia látky cudzorodé alebo nepotrebné
",1
21,Mitochondrie sú:,prítomné len v eukaryotických bunkách,1,od cytoplazmy oddelené dvojitou membránou,0,energetickým centrom bunky,0,prítomné v niektorých prokaryotických bunkách,0,metabolicko-respiračným centrom bunky,0,syntetickým centrom bunky,0,"prítomné vo väčšom počte v bunkách, kde je veľká spotreba energie",1,"bunkové organely, ktorými sa živočíšne bunky odlišujú od rastlinných",1
22,Bunkové jadro:,sa označuje ako karyon,1,sa označuje ako nucleus,1,sa skladá predovšetkým z RNA a bielkovín,0,eukaryotických buniek obsahuje kruhové chromozómy,0,"obsahuje DNA a bielkoviny, ktoré tvoria chromatín",1,má na povrchu karyolému,1,"má na povrchu plazmalému
",0,má na povrchu dve biomembrány,1
23,Ribozómy:,patria k membránovým organelám bunky,0,sú mikroskopické častice,0,sú submikroskopické častice,1,nepatria k membránovým organelám bunky,1,sú viditeľné len elektrónovým mikroskopom,1,sú napojené na hladké endoplazmatické retikulum,0,sú nukleoproteínovéčastice zložené z DNA a bielkovín,0,sí nukleoproteínové častice zložené z RNA a bielkovín,1
24,"Mitochondrie sú membránové organely, ktoré:",sú od cytoplazmy oddelené jednou membránou,0,"sú od cytoplazmy oddelené dvojitou membránou
",1,si sytetizujú svoje špecifické bielkoviny,1,majú v matrix molekuly DNA,1,majú v matrix enzýmový komplex pre Krebsov cyklus,1,sú vyplnené bunkovou šťavou,0,predstavujú dynamickú kostru bunky,0,majú v mitochondriálnych kristách lokalizované enzými dýchacieho reťazca,1
25,Koľko membrán majú mitochondrie:,jednu,0,dve - jednu zrnitú a jednu hladkú,0,dve,1,jednu alebo dve podľa energetických nárokov bunky,0,dve - vonkajšiu zriasenú a vnútornú hladkú,0,dve s mitochondriálnymi pórmi,0,jednu alebo dve podľa typu bunky,0,dve - jednu priepustnú a jednu polopriepustnú,0
26,Ktoré procesy sa uskutočnujú v Golgiho aparáte:,rozklad látok,0,"uprava látok, ktoré sa vylučujú z bunky",1,tvorba lyzozómov,1,tvorba pektínov na stavbu bunkových stien,1,oxidácia bielkovín,0,"syntéza hormónov, polysacharidov a nukleonových kyselín",0,bunkové oxidácie,0,tvorba inklúzií,0
27,Diktyozímy sú súčasťou:,chloroplastov,0,Golgiho aparátu,1,lyzozómov,0,endoplazmatického retikula,0,prokaryotických buniek,0,eukaryotických buniek,1,cytoskeletu,0,mitochondrií,0
28,Nukleolus:,je v cytoplazme a je zložený z RNA a bielkovín,0,je v jadre a skladá sa z DNA a bielkovín,0,je stála štruktúra jadra,0,jsa nachádza len v eukaryotických bunkách,1,je jadierko a je miestom syntézy rRNA,1,"je štruktúra, ktorá zaniká počas jadrového delenia",1,mán na povrchu karyolému,0,je uložený v cytoplazme prokaryotických buniek,0
29,Jadro eukaryotických buniek:,obsahuje chromatín,1,obsahuje centriol,0,je riadiace centrum bunky,1,je reprodukčné centrum bunky,1,je vyplnené bunkovou šťavou,0,je pohybové centrum bunky,0,je submikroskopická štruktúra,0,sa vyskytuje vo všetkých eukaryotických bunkách okrem niektorých vysokošpecializovaných buniek,1
30,"Bunkové organely, ktorých základom sú biomembrány, nazývame:",organelové štruktúry bunky,0,cytoplazmatické organely,0,membránové štruktúry bunky,1,biomembrány bunky,0,štruktúrne organely bunky,0,membránové organely bunky,1,eukaryotické organely,0,vezikuly,0
31,Medzi membránové organely nepatria:,ribozómy,1,lyzozómy,0,bakteriálne jadro,1,mitochondrie,0,centriol,1,cytoskelet,1,jadierko,1,vakuoly,0
32,Medzi membránové organely patria:,centrioly,0,centrozómy,0,ribozómy,1,chromozómy,0,Golgiho aparát,0,jadierka,0,lyzozómy,1,vakuoly,1
33,K mitotickému aparátu bunky patria:,centroméra,0,chromozómy,0,astrosféra,1,centrioly,1,pólové telieska,0,deliace vretienko,1,chromatídy,0,jedierkový organizátor,0
34,Chromozómy:,sú viditeľné len počas delenia bunky,1,sú viditeľné v interfáze,0,homologické majú rovnaký tvar a vždy rovnaké alely,0,majú centroméru v mieste druhotného zúženia,0,sú tvorené nukleoproteínovými vláknami,1,"majú ramená, ktoré sa spájajú v mieste centroméry",1,"v metafáze mitózy sú zložené z dvoch chromatíd, ktoré sú geneticky identické",1,v jadre eukaryotických buniek môžu byť aj kruhové,0
35,Obsah vody v bunkách:,je v priemere 65%,1,sa počas života organizmu nemení,0,závisí od ich prostredia,1,"závisí od orgánu, v ktorom sa nachádzajú",1,závisí od ich veku,1,ontogeneticky starších je väčší,0,ontogeneticky starších je menší,0,je v priemere 10 - 40% ich celkovej hmotnosti,0
36,Endocytóza:,je napr. pinocytóza,1,"je proces, pri ktorom dochádza k štrukturálnej prestavbe plazmatickej membrány",1,je pasívny transport látok do bunky,0,je aktívny transport látok do bunky,1,je aktívny transport látok von z bunky,0,nevyžaduje spotrebu energie,0,"sa uskutočňuje na báze difúzie a osmózy
",0,je napr. fagocytóza,1
37,Rastlinná bunka v hypertonickom prostredí:,stráca vodu,1,nasáva vodu,0,sa nemení,0,podlieha plazmolýze,1,podlieha plazmoptýze,0,zväčšuje svoj objem,0,zmenšuje svoj vnútorný objem,1,stráca vodu a cytoplazmatická membrána sa oddeľuje od bunkovej steny,1
38,Zivočíšna bunka v hypotonickom prostredí:,sa zmrští,0,praská,1,podlieha plazmoptýze,1,podlieha plazmolýze,0,sa nemení,0,osmoticky nasáva vodu,1,zväčšuje svoj objem,1,stráca vodu,0
39,Zivočíšna bunka v hypertonickom prostredí:,sa zmrští,1,praská,0,stráca vodu,1,podlieha plazmolýze,0,podlieha plazmoptýze,0,aktívne transportuje molekuly vody von z bunky,0,nasáva vodu z prostredia s vyššou koncentráciou osmoticky aktívnych častíc,0,zmenšuje svoj objem,1
40,"Difúzia a osmóza majú spoločné to, že:",ide o aktívny transport látok,0,vyžadujú spotrebu energie,0,ide o pasívny transport látok,1,ide o pohyb molekúl z miesta nižšej koncentrácie na miesto s vyššou koncentráciou,0,dochádza pri tom k štruktúralnej prestavbe plazmatickej membrány,0,ide o pohyb molekúl z miesta vyššej koncentrácie na miesto s nižšou koncentráciou,1,nevyžadujú spotrebu energie,1,nedochádza pri tom k štrukturálnej prestavbe plazmatickej membrány,1
41,"Bunkovou bariérou, ktorá selektívne prepúšťa potrebné látky do bunkya von z bunky, je:",jadrová membrána,0,plazmaléma,1,bunková stena,0,cytoplazmatická membrána,1,slizové púzdro,0,plazmatická membrána,1,fibrilárna štruktúra na povrchu bunky,0,cytoskelet,0
42,Pasívny transport látok cez plazmatickú membránu:,nevyžaduje spotrebu energie,1,je napr. prenos glukózy a aminokyselín proti koncentračnému spádu,0,zabezpečuje prenos látok proti koncentračnému spádu,0,je napr. difúzia,1,je napr. osmóza,1,prebieha v smere koncentračného spádu danej látky,1,nezávisí od koncentračného spádu danej látky,0,"je typický pre prechod molekúl vody, plynov, etanolu",1
43,Hypotonické prostredie:,je prostredie s nižšiou koncentráciou osmoticky aktívnych častí,1,je prostredie s vyššou koncentráciou osmoticky aktívnych častíc,0,podmieňuje plazmolýzu rastlinných buniek,0,spôsobuje plazmoptýzu živočíšnych buniek,1,spôsobuje lýzu červených krviniek,1,spôsobuje oddeľovanie plazmatickej membrány od bunkovej steny,0,je napr. destilovaná voda,1,podmieňuje osmotické nasávanie vody bunkou,1
44,Transportné bielkoviny plazmatickej membrány:,prenášajú látky vo forme vezikúl v smere ich koncentračného spádu,0,sú univerzálne pre všetky látky,0,špecificky viažu transportované látky,1,špecificky prenášajú niektoré látky do bunky,1,sú dôležité pri endocytóze,0,sa uplatňujú pri difúzii a osmóze,0,"prenášajú do bunky tie látky, ktorýcn icl1 štruktúra umožní prechod cez cytoplazmatickú membránu",0,sa uplatňujú pri sprostredkovanej difúzii,1
45,Nesprávne odpovede sú:,cytoskelet zabezpečuje funkciu pohybu len u riasiniek prvokov,1,vakuoly majú dôležitú úlohu pri metabolických pochodoch bunky,0,mikrotubuly obsahujú tubulín,0,mikrofilamenty obsahujú pektín,1,medzi centromérami vzniká deliace vretienko z mikrotubulov,1,jedným z typov chloroplastov sú plastidy,1,mikrofilamenty skracujú a mikrotubuly len nat'ahujú bunku,1,tylakoidy sa vyskytujú predovšetkým v chlorofyle a,1
46,Difúziou môžu cez biomembránu prechádzat':,do bunky všetky látky,0,z bunky všetky látky,0,plyny,1,etanol,0,niektoré ióny,1,"tie látky, ktorým ich štruktúra umožní prechod plazmatickou membránou",1,voda,1,niektoré látky proti smeru koncentračného spádu,0
47,Rýchlost' jednoduchej difúzie cez cytoplazmatickú membránu závisí:,od štrukturálnej prestavby plazmatickej membrány,0,od množstva energie vo forme ATP,0,od aktivity transportných bielkovín,0,od teploty,1,od koncentračného spádu,1,od aktivity cytoskeletu bunky,0,od enzýmovej aktivity membrány,0,od stupňa diferenciácie bunky,0
48,Bunka vytvára pseudopódie:,pri pinocytóze,0,pomocou cytoskeletu,1,pri fagocytóze,1,pri osmóze,0,pomocou mikrofilamentov,1,pričom uzatvára fagocytované čiastočky do fagocytovej vakuoly,1,pri exocytóze,0,pri pasívnom príjme látok do bunky,0
49,Aktívny transport cez cytoplazmatickú membránu umožňuje prenos:,vody,0,plynov,0,etanolu,0,iónov vápnika do svalovej bunky,1,látok pomocou transportných bielkovín,1,iónov sodíka z bunky,1,iónov draslíka do bunky,1,látky spravidla proti koncentráčnemu spadu,1
50,Bunkový cyklus:,sa označuje ako regenračná doba bunky,0,je naprogramovaný geneticky,1,sa pri nedostatku živín zastaví v S- fáze,0,je kontrolovaný mechanizmami pôsobiacimi hlavne v G1- fáze,1,môže byť narušený niektorými vírusmi,1,zahŕňa  prípravné fázy G 1 - postmitotickú a G2 - predmitotickú,1,"prokaryotických buniek má G1, S, G2 a M-fázu",0,zahŕňa  prípravne fázy G1 - predmitotickú a G2 - postmitotickú,0
51,Poradie všetkých fáz bunkového cyklu je nasledujúce:,karyokinéza a cytokinéza,0,"profáza, metafáza, anafáza, telofáza",0,heterotypické a homeotypické delenie,0,"G1, S, G2, M",1,"predmitotická fáza, S - fáza, postmitotická fáza, M- fáza",0,"amitóza, mitóza, meióza",0,interfáza a M - fáza,1,"postmitotická fáza, S - fáza, predmitotická fáza, M - fáza",1
52,Generčná doba bunky:,je daná geneticky,1,je pre rozličné bunky rovnaká,0,je časové trvanie bunkového cyklu,1,je pre rozličné typy buniek rozdielna,1,nezávisí od množstva živín v prostredí,0,je časové trvanie interfázy,0,je časové trvanie regenerácie bunky,0,je ovplyvnená množstvom vhodných živín v prostredí,1
53,Priebeh bunkového cyklu a jeho reguláciu možno dobre študovať':,na bunkách pestovaných in vivo,0,na vírusoch,0,na baktériách pestovaných in vivo,0,na bunkách pestovaných in vitro,1,na nádorových bunkách,0,na bunkách pestovaných mimo živého organizmu na živných pôdach,1,na bunkových a pletivových kultúrach,1,na diferencovaných bunkách,0
54,Interfáza:,"je obdobie, ked' sa bunka nedelí",1,zahŕňa mitózu,0,sa označuje ako bunkový cyklus,0,sa označuje ako generačná doba bunky,0,"zahŕňa profázu, metafázu, anafázu, telo fázu",0,"zahŕňa postmitotickú fázu, S - fázu a predmitotickú fázu",1,zahŕňa hlavný kontrolný uzol celého bunkového cyklu,1,je rastová fáza bunkového cyklu,1
55,Pri nedostatku živín v prostredí sa generačná doba bunky:,nemení,0,zrýchľuje,0,predlžuje,1,zrýchľuje  za vzniku nádorových buniek,0,"skráti, pretože sa zastavuje priebeh G, fázy",0,"nemení, pretože sa zastavuje priebeh bunkového cyklu",0,"predlžuje, pretože sa zastavuje nielen priebeh G1 - fázy, ale aj celého bunkového cyklu",1,"zrýchľuje, pretože bunka urýchlene prechádza do M - fázy",0
56,G1- fáza bunkového cyklu:,sa označuje ako predmitotická,0,sa označuje ako postmitotická,1,začína v okamihu vzniku dcérskej bunky,1,začína v okamihu zániku dcérskej bunky,0,je začiatkom vlastného bunkového cyklu dcérskej bunky,1,je charakterizovaná rastovými procesmi,1,z hľadiska časového trvania je najkratšia,0,z hľadiska časového trvania je najvariabilnejšia,1
57,V G1 - fáze:,prebieha syntéza bielkovín,1,sa nachádza hlavný kontrolný uzol bunkového cyklu,1,prebieha zdvojenie jadrových chromozómov,0,sa bunka pripravuje na rozdelenie jadra,0,sa nachádza kontrolný uzol karyokinézy,0,sa nachádza kontrolný uzol cytokinézy,0,dochádza k zmnoženiu bunkových štruktúr,1,neprebieha zdvojenie jadrových chromozómov,1
58,Sesterské chromatídy:,vznikajú replikáciou DNA v S-fáze,1,sú homologické,0,sú spojené centromérou,1,sa rozchádzajú v anafáze mitózy,1,sa rozchádzajú v anafáze I. meiotického delenia,0,sa rozchádzajú v anafáze II. meiotického delenia,1,sa rozchádzajú v anafáze heterotypického delenia,0,sú geneticky identické,1
59,Označte nesprávnnu odpoveď:,v priebehu profázy sa chromozómy skracujú a hrubnú,0,v metafáze sa chromozómy zoraďujú do centrálnej roviny a priečne sa rozdeľujú v centromére,1,v S- fáze bunkového cyklu prebieha syntéza DNA,0,v profáze sa centrozóm rozdelí a obidva nové sa presunú oproti sebe v centre jadra,1,v priebehu telofázy zanikajú vlákna deliaceho vretienka,0,na začiatku anafázy sa v blízkosti každého centrozómu sústredí diploidný počet chromozómov,1,v G1- fáza sa nazýva hlavný kontrolný uzol bunkového cyklu,1,v profáze I sa chromatídy homologických chromozómov prekrížia a vymenia si navzájom genetický materiál,0
60,"Bielkoviny, ktoré sa syntetizujú v G1 - fáze sa využívajú najmä:",na tvorbu mitotického aparátu,0,na tvorbu bunkových organel,1,na tvorbu jednochromatídových chromozómov,0,na rastové procesy v bunke,1,na znásobenie bunkových štruktúr,1,na tvorbu zásobných štruktúr,0,na tvorbu deliaceho vretienka,0,na tvorbu plazmatickej platničky,0
61,Kľúčovým procesom S- fázy je:,syntéza DNA,1,zdvojenie jednochromatídových chromozómov,1,rozdelenie jadrových chromozómov,0,regenrácia jadra,0,zdvojenie bunkových organel,0,zdvojenie dvojchromatídových chromozómov,0,znásobenie genetického materiálu bunky,1,zdvojenie počtu homologických chromozómov,0
62,Karyokinéza a cytokinéza prebiehajú:,v interfáze bunkového cyklu,0,v M- fáze bunkového cyklu,1,v telofáze mitózy,1,v G2 - fáze bunkového cyklu,0,v telofáze II,1,v metafáze bunkového cyklu,0,v postmitotickej fáze,0,v telofáze I,1
63,Do interfázy bunkového cyklu patrí:,G2 - fáza,1,G1 - fáza,1,M - fáza,0,meióza,0,mitóza,0,predmitotická G1 - fáza,0,S- fáza,1,postmitotická G2 - fáza,0
64,Chemické regulačné mechanizmy bunkového cyklu:,môžu mať stimulačný účinok na bunkové delenie,1,môžu mať inhibičný účinok na bunkové delenie,1,sú napr. cytostatiká,1,sú účinné najmä v G1 - fáze,1,"sú účinné najmä v M - fáze, kde je hlavný kontrolný uzol bunkového cyklu",0,"sú napr. vírusy, ktoré môžu spôsobiť nekoordinované delenie buniek",0,podmieňujú funkčné a tvarové odlíšenie buniek,0,"sú účinné najmä na bunky, ktoré majú vzhľadom na svoju funkciu geneticky trvalo zablokovanú schopnosť sa deliť",0
65,Reguláciu bunkového cyklu môžu ovplyvnit':,"cytostatiká, ktoré spomaľujú alebo zastavujú bunkové delenie",1,"cytostatiká, ktoré stimulujú bunkové delenie",0,"vonkajšie faktory, napr. teplota",1,"niektoré vírusy, za vzniku rakoviny",1,inhibítory - napr. kolchicín,1,"rastové regulátory, ktoré sa môžu aplikovať aj zámerne",1,"vonkajšie faktory, napr. dostatok živín v prostredí",1,rastové hormóny,1
66,Stimulujúci účinok na bunkový cyklus:,majú cytostatiká,0,má napr. kolchicín,0,majú niektoré inhibítory rastu,0,má hlavný kontrolný uzol bunkového cyklu v G1 - fáze,0,majú niektoré vírusy,1,majú rastové hormóny,1,majú niektoré rastové regulátory,1,majú antibiotiká,0
67,V profáze mitózy:,sa centriol delí a každá. polovica putuje na opačný pól jadra,0,sú chromozómy dvojchromatídové,1,sú chromozómy jednochromatídové,0,sa chromozómy skracujú,1,sa chromozómy špiralizujú,1,zaniká jadrová membrána,1,sa chromozómy dešpiralizujú,0,sa centrozómy oddelia a každý putuje na opačný pól bunky,1
68,V metafáze mitózy:,sú chromozómy dvojchromatídové,1,sú chromozómy jednochromatídové,0,sajednochromatídové chromozómy zdvojujú na dvojchromatídové,0,sú chromozómy zoradené do centrálnej roviny,1,sa chromozómy d'alej dešpiralizujú,0,sa rozchádzajú dcérske chromatídy na protiľahlé póly bunky,0,vrcholí špiralizácia chromozómov,1,sa mikrotubuly deliaceho vretienka upínajú na centroméru každého chromozómu,1
69,V telofáze mitózy:,sa chromozómy postupne špiralizujú,0,sa chromozómy postupne dešpiralizujú,1,sú chromozómy dvojchromatídové,0,sú chromozómy jednochromatídové,1,zaniká deliace vretienko,1,sa rozpúšťa jadrová membrána,0,zaniká jadierko,0,sa obnovuje štruktúra jadra,1
70,Cytokinéza:,"je veda, ktorá skúma tvar a štruktúru buniek ",0,sa začína a končí rozdelením jadra na dve dcérske,0,je pozdĺžne rozdelenie bunky a jadra,0,podmieňuje vznik viacjadrových buniek,0,je súčaťou interfázy,0,je obdobie rastu bunky,0,označuje pohyby bunky,0,je rozdelenie materskej bunky na dve samostatné dcérske bunky,1
71,Telové bunky živočíchov:,sú haploidné,0,sú diploidné,1,majú 2n chromozómov,1,sú genetický homologické,0,sú geneticky identické,1,sú genetický odlišné,0,diferencované sú geneticky odlišné,0,vznikajú heterotypickým a homeotypickým delením,0
72,Bivalenty vznikajú:,v profáze homeotypického delenia meiózy,0,v anafáze heterotypického delenia meiózy,0,v profáze heterotypického delenia meiózy,1,párovaním  homologických chromozómov,1,párovaním geneticky identických chromozómov,0,párovaním heterologických chromozómov,0,v profáze I a zanikajú v anafáze I,1,v profáze heterotypického delenia mitózy,0
73,Označte správnu odpoved':,meiózou sa delia len diploidné bunky,1,meiózou sa delia len haploidné bunky,0,v anafáze I putujú k protiľahlým pólo1n bunky jednotlivé chromatídy,0,v anafáze I putujú k protiľahlým pólom bunky dvojchromatídové chromozómy,1,v metafáze I sa sústred'ujú v centrálnej rovine jednotlivé chromozómy,0,v metafáze I sa sústred'ujú v centrálnej rovine bivalenty,1,crossing-over prebieha v profáze homeotypického delenia,0,druhé meiotické delenie je charakteristické redukciou počtu chromozómov na polovicu,0
